resnet-18-NHWC-B1-cuda.json
{"i": [["[\"d7b65649a4dd54becea0a52aabbc5af5\", 1, 1000, 1, 1000]", "cuda -keys=cuda,gpu -max_num_threads=1024 -thread_warp_size=32", [-1, 16, 64, 2147483647, 2147483647, 1024, 8, 32], "", 0, []], [[], [["CI", 2], ["FU", 4, [0, 1]], ["SP", 4, 0, 1000, [8], 1], ["AN", 4, 0, 5], ["AN", 4, 1, 6], ["AN", 3, 0, 6], ["AN", 1, 0, 6], ["PR", 1, 0, "auto_unroll_max_step$1024"], ["PR", 3, 0, "auto_unroll_max_step$1024"]]]], "r": [[2.40717e-05], 0, 1.01995, 1649058614], "v": "v0.6"}
{"i": [["[\"d7b65649a4dd54becea0a52aabbc5af5\", 1, 1000, 1, 1000]", "cuda -keys=cuda,gpu -max_num_threads=1024 -thread_warp_size=32", [-1, 16, 64, 2147483647, 2147483647, 1024, 8, 32], "", 0, []], [[], [["SP", 4, 1, 1000, [16], 1], ["AN", 4, 2, 6], ["FSP", 3, 1, 0, 1], ["AN", 3, 2, 6], ["CA", 3, 4, 0], ["CI", 2], ["FSP", 1, 1, 0, 1], ["AN", 1, 2, 6], ["CA", 1, 4, 0], ["AN", 4, 0, 5], ["PR", 1, 0, "auto_unroll_max_step$0"], ["PR", 3, 0, "auto_unroll_max_step$16"]]]], "r": [[1.05639e-05], 0, 1.05062, 1649058615], "v": "v0.6"}
{"i": [["[\"d7b65649a4dd54becea0a52aabbc5af5\", 1, 1000, 1, 1000]", "cuda -keys=cuda,gpu -max_num_threads=1024 -thread_warp_size=32", [-1, 16, 64, 2147483647, 2147483647, 1024, 8, 32], "", 0, []], [[], [["CI", 2], ["FU", 4, [0, 1]], ["SP", 4, 0, 1000, [4], 1], ["AN", 4, 0, 5], ["AN", 4, 1, 6], ["AN", 3, 0, 6], ["AN", 1, 0, 6], ["PR", 1, 0, "auto_unroll_max_step$0"], ["PR", 3, 0, "auto_unroll_max_step$16"]]]], "r": [[2.41376e-05], 0, 1.15777, 1649058616], "v": "v0.6"}
{"i": [["[\"d7b65649a4dd54becea0a52aabbc5af5\", 1, 1000, 1, 1000]", "cuda -keys=cuda,gpu -max_num_threads=1024 -thread_warp_size=32", [-1, 16, 64, 2147483647, 2147483647, 1024, 8, 32], "", 0, []], [[], [["CI", 2], ["FU", 4, [0, 1]], ["SP", 4, 0, 1000, [2], 1], ["AN", 4, 0, 5], ["AN", 4, 1, 6], ["AN", 3, 0, 6], ["AN", 1, 0, 6], ["PR", 1, 0, "auto_unroll_max_step$0"], ["PR", 3, 0, "auto_unroll_max_step$64"]]]], "r": [[2.4358e-05], 0, 1.08777, 1649058617], "v": "v0.6"}
{"i": [["[\"d7b65649a4dd54becea0a52aabbc5af5\", 1, 1000, 1, 1000]", "cuda -keys=cuda,gpu -max_num_threads=1024 -thread_warp_size=32", [-1, 16, 64, 2147483647, 2147483647, 1024, 8, 32], "", 0, []], [[], [["CI", 2], ["FU", 4, [0, 1]], ["SP", 4, 0, 1000, [4], 1], ["AN", 4, 0, 5], ["AN", 4, 1, 6], ["AN", 3, 0, 6], ["AN", 1, 0, 6], ["PR", 1, 0, "auto_unroll_max_step$64"], ["PR", 3, 0, "auto_unroll_max_step$512"]]]], "r": [[2.41038e-05], 0, 1.06497, 1649058618], "v": "v0.6"}
{"i": [["[\"d7b65649a4dd54becea0a52aabbc5af5\", 1, 1000, 1, 1000]", "cuda -keys=cuda,gpu -max_num_threads=1024 -thread_warp_size=32", [-1, 16, 64, 2147483647, 2147483647, 1024, 8, 32], "", 0, []], [[], [["SP", 4, 1, 1000, [2], 1], ["AN", 4, 2, 6], ["FSP", 3, 1, 0, 1], ["AN", 3, 2, 6], ["CA", 3, 4, 0], ["CI", 2], ["AN", 4, 0, 5], ["AN", 1, 0, 6], ["PR", 1, 0, "auto_unroll_max_step$16"], ["PR", 3, 0, "auto_unroll_max_step$16"]]]], "r": [[6.32928e-05], 0, 1.17676, 1649058619], "v": "v0.6"}
{"i": [["[\"d7b65649a4dd54becea0a52aabbc5af5\", 1, 1000, 1, 1000]", "cuda -keys=cuda,gpu -max_num_threads=1024 -thread_warp_size=32", [-1, 16, 64, 2147483647, 2147483647, 1024, 8, 32], "", 0, []], [[], [["SP", 4, 1, 1000, [2], 1], ["AN", 4, 2, 6], ["FSP", 3, 1, 0, 1], ["AN", 3, 2, 6], ["CA", 3, 4, 0], ["CI", 2], ["FSP", 1, 1, 0, 1], ["AN", 1, 2, 6], ["CA", 1, 4, 0], ["AN", 4, 0, 5], ["PR", 1, 0, "auto_unroll_max_step$64"], ["PR", 3, 0, "auto_unroll_max_step$512"]]]], "r": [[5.46145e-05], 0, 1.66194, 1649058620], "v": "v0.6"}
{"i": [["[\"d7b65649a4dd54becea0a52aabbc5af5\", 1, 1000, 1, 1000]", "cuda -keys=cuda,gpu -max_num_threads=1024 -thread_warp_size=32", [-1, 16, 64, 2147483647, 2147483647, 1024, 8, 32], "", 0, []], [[], [["CI", 2], ["FU", 4, [0, 1]], ["SP", 4, 0, 1000, [16], 1], ["AN", 4, 0, 5], ["AN", 4, 1, 6], ["AN", 3, 0, 6], ["AN", 1, 0, 6], ["PR", 1, 0, "auto_unroll_max_step$1024"], ["PR", 3, 0, "auto_unroll_max_step$512"]]]], "r": [[2.39824e-05], 0, 1.1278, 1649058621], "v": "v0.6"}
{"i": [["[\"9847f8cc0b305137f49f2c5c0c8ab25d\", 1, 512, 1000, 512, 1000, 1, 1000]", "cuda -keys=cuda,gpu -max_num_threads=1024 -thread_warp_size=32", [-1, 16, 64, 2147483647, 2147483647, 1024, 8, 32], "", 0, []], [[], [["SP", 2, 0, 1, [1, 1, 1, 1], 1], ["SP", 2, 5, 1000, [4, 50, 5, 1], 1], ["SP", 2, 10, 512, [8, 1], 1], ["RE", 2, [0, 5, 1, 6, 2, 7, 10, 11, 3, 8, 12, 4, 9]], ["FSP", 4, 0, 0, 3], ["FSP", 4, 4, 1, 3], ["RE", 4, [0, 4, 1, 5, 2, 6, 3, 7]], ["CA", 2, 4, 5], ["CHR", 1, "shared", [2]], ["CA", 2, 3, 6], ["CHR", 0, "shared", [3]], ["CA", 1, 4, 6], ["FU", 6, [0, 1]], ["AN", 6, 0, 5], ["FU", 6, [1, 2]], ["AN", 6, 1, 4], ["FU", 6, [2, 3]], ["AN", 6, 2, 6], ["FU", 3, [0, 1]], ["SP", 3, 0, 40, [1], 1], ["AN", 3, 1, 2], ["FFSP", 3, 0, [1, 0], 1, 1], ["AN", 3, 1, 6], ["FU", 1, [0, 1]], ["SP", 1, 0, 8, [2], 1], ["AN", 1, 1, 2], ["FFSP", 1, 0, [1, 0], 1, 1], ["AN", 1, 1, 6], ["PR", 4, 0, "auto_unroll_max_step$1024"]]]], "r": [[0.000128084], 0, 1.26124, 1649058626], "v": "v0.6"}
{"i": [["[\"9847f8cc0b305137f49f2c5c0c8ab25d\", 1, 512, 1000, 512, 1000, 1, 1000]", "cuda -keys=cuda,gpu -max_num_threads=1024 -thread_warp_size=32", [-1, 16, 64, 2147483647, 2147483647, 1024, 8, 32], "", 0, []], [[], [["SP", 2, 0, 1, [1, 1, 1, 1], 1], ["SP", 2, 5, 1000, [1, 1000, 1, 1], 1], ["SP", 2, 10, 512, [2, 4], 1], ["RE", 2, [0, 5, 1, 6, 2, 7, 10, 11, 3, 8, 12, 4, 9]], ["FSP", 4, 0, 0, 3], ["FSP", 4, 4, 1, 3], ["RE", 4, [0, 4, 1, 5, 2, 6, 3, 7]], ["CA", 2, 4, 5], ["CHR", 1, "shared", [2]], ["CA", 2, 3, 6], ["CHR", 0, "shared", [3]], ["CA", 1, 4, 6], ["FU", 6, [0, 1]], ["AN", 6, 0, 5], ["FU", 6, [1, 2]], ["AN", 6, 1, 4], ["FU", 6, [2, 3]], ["AN", 6, 2, 6], ["FU", 3, [0, 1]], ["SP", 3, 0, 2, [1], 1], ["AN", 3, 1, 2], ["FFSP", 3, 0, [1, 0], 1, 1], ["AN", 3, 1, 6], ["FU", 1, [0, 1]], ["SP", 1, 0, 2, [1], 1], ["AN", 1, 1, 2], ["FFSP", 1, 0, [1, 0], 1, 1], ["AN", 1, 1, 6], ["PR", 4, 0, "auto_unroll_max_step$16"]]]], "r": [[7.7974e-05], 0, 1.12502, 1649058627], "v": "v0.6"}
{"i": [["[\"9847f8cc0b305137f49f2c5c0c8ab25d\", 1, 512, 1000, 512, 1000, 1, 1000]", "cuda -keys=cuda,gpu -max_num_threads=1024 -thread_warp_size=32", [-1, 16, 64, 2147483647, 2147483647, 1024, 8, 32], "", 0, []], [[], [["SP", 2, 0, 1, [1, 1, 1, 1], 1], ["SP", 2, 5, 1000, [10, 50, 2, 1], 1], ["SP", 2, 10, 512, [4, 2], 1], ["RE", 2, [0, 5, 1, 6, 2, 7, 10, 11, 3, 8, 12, 4, 9]], ["FSP", 4, 0, 0, 3], ["FSP", 4, 4, 1, 3], ["RE", 4, [0, 4, 1, 5, 2, 6, 3, 7]], ["CA", 2, 4, 5], ["CHR", 1, "shared", [2]], ["CA", 2, 3, 6], ["CHR", 0, "shared", [3]], ["CA", 1, 4, 6], ["FU", 6, [0, 1]], ["AN", 6, 0, 5], ["FU", 6, [1, 2]], ["AN", 6, 1, 4], ["FU", 6, [2, 3]], ["AN", 6, 2, 6], ["FU", 3, [0, 1]], ["SP", 3, 0, 16, [1], 1], ["AN", 3, 1, 2], ["FFSP", 3, 0, [1, 0], 1, 1], ["AN", 3, 1, 6], ["FU", 1, [0, 1]], ["SP", 1, 0, 8, [1], 1], ["AN", 1, 1, 2], ["FFSP", 1, 0, [1, 0], 1, 1], ["AN", 1, 1, 6], ["PR", 4, 0, "auto_unroll_max_step$512"]]]], "r": [[0.000151467], 0, 1.34747, 1649058628], "v": "v0.6"}
{"i": [["[\"9847f8cc0b305137f49f2c5c0c8ab25d\", 1, 512, 1000, 512, 1000, 1, 1000]", "cuda -keys=cuda,gpu -max_num_threads=1024 -thread_warp_size=32", [-1, 16, 64, 2147483647, 2147483647, 1024, 8, 32], "", 0, []], [[], [["SP", 2, 0, 1, [1, 1, 1, 1], 1], ["SP", 2, 5, 1000, [1, 125, 2, 2], 1], ["SP", 2, 10, 512, [1, 2], 1], ["RE", 2, [0, 5, 1, 6, 2, 7, 10, 11, 3, 8, 12, 4, 9]], ["FSP", 4, 0, 0, 3], ["FSP", 4, 4, 1, 3], ["RE", 4, [0, 4, 1, 5, 2, 6, 3, 7]], ["CA", 2, 4, 5], ["CHR", 1, "shared", [2]], ["CA", 2, 3, 6], ["CHR", 0, "shared", [3]], ["CA", 1, 4, 6], ["FU", 6, [0, 1]], ["AN", 6, 0, 5], ["FU", 6, [1, 2]], ["AN", 6, 1, 4], ["FU", 6, [2, 3]], ["AN", 6, 2, 6], ["FU", 3, [0, 1]], ["SP", 3, 0, 8, [1], 1], ["AN", 3, 1, 2], ["FFSP", 3, 0, [1, 0], 1, 1], ["AN", 3, 1, 6], ["FU", 1, [0, 1]], ["SP", 1, 0, 2, [2], 1], ["AN", 1, 1, 2], ["FFSP", 1, 0, [1, 0], 1, 1], ["AN", 1, 1, 6], ["PR", 4, 0, "auto_unroll_max_step$0"]]]], "r": [[0.000134035], 0, 1.21545, 1649058629], "v": "v0.6"}
{"i": [["[\"9847f8cc0b305137f49f2c5c0c8ab25d\", 1, 512, 1000, 512, 1000, 1, 1000]", "cuda -keys=cuda,gpu -max_num_threads=1024 -thread_warp_size=32", [-1, 16, 64, 2147483647, 2147483647, 1024, 8, 32], "", 0, []], [[], [["SP", 2, 0, 1, [1, 1, 1, 1], 1], ["SP", 2, 5, 1000, [2, 50, 1, 5], 1], ["SP", 2, 10, 512, [2, 2], 1], ["RE", 2, [0, 5, 1, 6, 2, 7, 10, 11, 3, 8, 12, 4, 9]], ["FSP", 4, 0, 0, 3], ["FSP", 4, 4, 1, 3], ["RE", 4, [0, 4, 1, 5, 2, 6, 3, 7]], ["CA", 2, 4, 5], ["CHR", 1, "shared", [2]], ["CA", 2, 3, 6], ["CHR", 0, "shared", [3]], ["CA", 1, 4, 6], ["FU", 6, [0, 1]], ["AN", 6, 0, 5], ["FU", 6, [1, 2]], ["AN", 6, 1, 4], ["FU", 6, [2, 3]], ["AN", 6, 2, 6], ["FU", 3, [0, 1]], ["SP", 3, 0, 20, [1], 1], ["AN", 3, 1, 2], ["FFSP", 3, 0, [1, 0], 1, 1], ["AN", 3, 1, 6], ["FU", 1, [0, 1]], ["SP", 1, 0, 4, [2], 1], ["AN", 1, 1, 2], ["FFSP", 1, 0, [1, 0], 1, 1], ["AN", 1, 1, 6], ["PR", 4, 0, "auto_unroll_max_step$512"]]]], "r": [[9.51834e-05], 0, 1.15146, 1649058630], "v": "v0.6"}
{"i": [["[\"9847f8cc0b305137f49f2c5c0c8ab25d\", 1, 512, 1000, 512, 1000, 1, 1000]", "cuda -keys=cuda,gpu -max_num_threads=1024 -thread_warp_size=32", [-1, 16, 64, 2147483647, 2147483647, 1024, 8, 32], "", 0, []], [[], [["SP", 2, 0, 1, [1, 1, 1, 1], 1], ["SP", 2, 5, 1000, [1, 1, 1000, 1], 1], ["SP", 2, 10, 512, [1, 1], 1], ["RE", 2, [0, 5, 1, 6, 2, 7, 10, 11, 3, 8, 12, 4, 9]], ["FSP", 4, 0, 0, 3], ["FSP", 4, 4, 1, 3], ["RE", 4, [0, 4, 1, 5, 2, 6, 3, 7]], ["CA", 2, 4, 5], ["CHR", 1, "shared", [2]], ["CA", 2, 3, 6], ["CHR", 0, "shared", [3]], ["CA", 1, 4, 6], ["FU", 6, [0, 1]], ["AN", 6, 0, 5], ["FU", 6, [1, 2]], ["AN", 6, 1, 4], ["FU", 6, [2, 3]], ["AN", 6, 2, 6], ["FU", 3, [0, 1]], ["SP", 3, 0, 40, [1], 1], ["AN", 3, 1, 2], ["FFSP", 3, 0, [1, 0], 1, 1], ["AN", 3, 1, 6], ["FU", 1, [0, 1]], ["SP", 1, 0, 8, [1], 1], ["AN", 1, 1, 2], ["FFSP", 1, 0, [1, 0], 1, 1], ["AN", 1, 1, 6], ["PR", 4, 0, "auto_unroll_max_step$512"]]]], "r": [[0.0325668], 0, 1.08018, 1649058631], "v": "v0.6"}
{"i": [["[\"69115f188984ae34ede37c3b8ca40b43\", 1, 7, 7, 512, 1, 1, 1, 512]", "cuda -keys=cuda,gpu -max_num_threads=1024 -thread_warp_size=32", [-1, 16, 64, 2147483647, 2147483647, 1024, 8, 32], "", 0, []], [[], [["FU", 2, [0, 1, 2, 3]], ["SP", 2, 0, 512, [64], 1], ["AN", 2, 0, 5], ["AN", 2, 1, 6], ["FU", 1, [0, 1, 2, 3]], ["SP", 1, 0, 512, [32], 1], ["AN", 1, 0, 5], ["AN", 1, 1, 6], ["PR", 1, 0, "auto_unroll_max_step$16"]]]], "r": [[2.63424e-06], 0, 1.36389, 1649058641], "v": "v0.6"}
{"i": [["[\"69115f188984ae34ede37c3b8ca40b43\", 1, 7, 7, 512, 1, 1, 1, 512]", "cuda -keys=cuda,gpu -max_num_threads=1024 -thread_warp_size=32", [-1, 16, 64, 2147483647, 2147483647, 1024, 8, 32], "", 0, []], [[], [["FU", 2, [0, 1, 2, 3]], ["SP", 2, 0, 512, [32], 1], ["AN", 2, 0, 5], ["AN", 2, 1, 6], ["FU", 1, [0, 1, 2, 3]], ["SP", 1, 0, 512, [2], 1], ["AN", 1, 0, 5], ["AN", 1, 1, 6], ["PR", 1, 0, "auto_unroll_max_step$512"]]]], "r": [[3.08179e-06], 0, 1.00164, 1649058642], "v": "v0.6"}
{"i": [["[\"69115f188984ae34ede37c3b8ca40b43\", 1, 7, 7, 512, 1, 1, 1, 512]", "cuda -keys=cuda,gpu -max_num_threads=1024 -thread_warp_size=32", [-1, 16, 64, 2147483647, 2147483647, 1024, 8, 32], "", 0, []], [[], [["FU", 2, [0, 1, 2, 3]], ["SP", 2, 0, 512, [64], 1], ["AN", 2, 0, 5], ["AN", 2, 1, 6], ["FU", 1, [0, 1, 2, 3]], ["SP", 1, 0, 512, [4], 1], ["AN", 1, 0, 5], ["AN", 1, 1, 6], ["PR", 1, 0, "auto_unroll_max_step$512"]]]], "r": [[2.86034e-06], 0, 0.816412, 1649058643], "v": "v0.6"}
{"i": [["[\"69115f188984ae34ede37c3b8ca40b43\", 1, 7, 7, 512, 1, 1, 1, 512]", "cuda -keys=cuda,gpu -max_num_threads=1024 -thread_warp_size=32", [-1, 16, 64, 2147483647, 2147483647, 1024, 8, 32], "", 0, []], [[], [["FU", 2, [0, 1, 2, 3]], ["SP", 2, 0, 512, [64], 1], ["AN", 2, 0, 5], ["AN", 2, 1, 6], ["FU", 1, [0, 1, 2, 3]], ["SP", 1, 0, 512, [1], 1], ["AN", 1, 0, 5], ["AN", 1, 1, 6], ["PR", 1, 0, "auto_unroll_max_step$512"]]]], "r": [[3.4685e-06], 0, 0.989731, 1649058644], "v": "v0.6"}
{"i": [["[\"69115f188984ae34ede37c3b8ca40b43\", 1, 7, 7, 512, 1, 1, 1, 512]", "cuda -keys=cuda,gpu -max_num_threads=1024 -thread_warp_size=32", [-1, 16, 64, 2147483647, 2147483647, 1024, 8, 32], "", 0, []], [[], [["FU", 2, [0, 1, 2, 3]], ["SP", 2, 0, 512, [64], 1], ["AN", 2, 0, 5], ["AN", 2, 1, 6], ["FU", 1, [0, 1, 2, 3]], ["SP", 1, 0, 512, [8], 1], ["AN", 1, 0, 5], ["AN", 1, 1, 6], ["PR", 1, 0, "auto_unroll_max_step$512"]]]], "r": [[2.70812e-06], 0, 0.905543, 1649058644], "v": "v0.6"}
{"i": [["[\"69115f188984ae34ede37c3b8ca40b43\", 1, 7, 7, 512, 1, 1, 1, 512]", "cuda -keys=cuda,gpu -max_num_threads=1024 -thread_warp_size=32", [-1, 16, 64, 2147483647, 2147483647, 1024, 8, 32], "", 0, []], [[], [["FU", 2, [0, 1, 2, 3]], ["SP", 2, 0, 512, [8], 1], ["AN", 2, 0, 5], ["AN", 2, 1, 6], ["FU", 1, [0, 1, 2, 3]], ["SP", 1, 0, 512, [64], 1], ["AN", 1, 0, 5], ["AN", 1, 1, 6], ["PR", 1, 0, "auto_unroll_max_step$512"]]]], "r": [[2.79484e-06], 0, 0.932504, 1649058645], "v": "v0.6"}
{"i": [["[\"69115f188984ae34ede37c3b8ca40b43\", 1, 7, 7, 512, 1, 1, 1, 512]", "cuda -keys=cuda,gpu -max_num_threads=1024 -thread_warp_size=32", [-1, 16, 64, 2147483647, 2147483647, 1024, 8, 32], "", 0, []], [[], [["FU", 2, [0, 1, 2, 3]], ["SP", 2, 0, 512, [64], 1], ["AN", 2, 0, 5], ["AN", 2, 1, 6], ["FU", 1, [0, 1, 2, 3]], ["SP", 1, 0, 512, [16], 1], ["AN", 1, 0, 5], ["AN", 1, 1, 6], ["PR", 1, 0, "auto_unroll_max_step$64"]]]], "r": [[2.66877e-06], 0, 0.84529, 1649058646], "v": "v0.6"}
{"i": [["[\"69115f188984ae34ede37c3b8ca40b43\", 1, 7, 7, 512, 1, 1, 1, 512]", "cuda -keys=cuda,gpu -max_num_threads=1024 -thread_warp_size=32", [-1, 16, 64, 2147483647, 2147483647, 1024, 8, 32], "", 0, []], [[], [["FU", 2, [0, 1, 2, 3]], ["SP", 2, 0, 512, [64], 1], ["AN", 2, 0, 5], ["AN", 2, 1, 6], ["FU", 1, [0, 1, 2, 3]], ["SP", 1, 0, 512, [64], 1], ["AN", 1, 0, 5], ["AN", 1, 1, 6], ["PR", 1, 0, "auto_unroll_max_step$64"]]]], "r": [[2.72684e-06], 0, 0.938351, 1649058646], "v": "v0.6"}
{"i": [["[\"ad6cecbf5d85cb1cda3c2bb7af170211\", 1, 7, 7, 512, 4, 4, 512, 512, 1, 7, 7, 512, 1, 1, 1, 512, 1, 1, 1, 512, 1, 7, 7, 512]", "cuda -keys=cuda,gpu -max_num_threads=1024 -thread_warp_size=32", [-1, 16, 64, 2147483647, 2147483647, 1024, 8, 32], "", 0, []], [[], [["CI", 15], ["CI", 13], ["CI", 11], ["CI", 9], ["AN", 8, 0, 1], ["AN", 8, 1, 1], ["SP", 8, 2, 16, [8], 1], ["SP", 8, 4, 512, [16], 1], ["AN", 8, 6, 1], ["AN", 8, 7, 1], ["RE", 8, [2, 4, 3, 5, 0, 1, 6, 7]], ["CI", 7], ["CHW", 6, "local"], ["SP", 6, 0, 4, [1, 2, 1, 1], 1], ["SP", 6, 5, 4, [1, 1, 1, 4], 1], ["SP", 6, 10, 16, [1, 16, 1, 1], 1], ["SP", 6, 15, 512, [1, 2, 8, 1], 1], ["SP", 6, 20, 512, [16, 2], 1], ["RE", 6, [0, 5, 10, 15, 1, 6, 11, 16, 2, 7, 12, 17, 20, 21, 3, 8, 13, 18, 22, 4, 9, 14, 19]], ["FSP", 7, 0, 13, 3], ["FSP", 7, 4, 14, 3], ["FSP", 7, 8, 15, 3], ["FSP", 7, 12, 16, 3], ["RE", 7, [0, 4, 8, 12, 1, 5, 9, 13, 2, 6, 10, 14, 3, 7, 11, 15]], ["CA", 6, 7, 11], ["CHR", 5, "shared", [6]], ["CA", 6, 7, 12], ["CHR", 4, "shared", [7]], ["CA", 5, 8, 12], ["AN", 4, 0, 1], ["AN", 4, 1, 1], ["SP", 4, 2, 16, [4], 1], ["SP", 4, 4, 512, [64], 1], ["AN", 4, 6, 1], ["AN", 4, 7, 1], ["RE", 4, [2, 4, 3, 5, 0, 1, 6, 7]], ["CI", 3], ["CA", 2, 4, 3], ["CI", 1], ["FU", 19, [0, 1, 2, 3]], ["SP", 19, 0, 25088, [32], 1], ["AN", 19, 0, 5], ["AN", 19, 1, 6], ["FU", 11, [0, 1, 2, 3]], ["SP", 11, 0, 8192, [32], 1], ["AN", 11, 0, 5], ["AN", 11, 1, 6], ["FU", 9, [0, 1, 2, 3]], ["AN", 9, 0, 5], ["FU", 9, [1, 2, 3, 4]], ["AN", 9, 1, 4], ["FU", 9, [2, 3, 4, 5]], ["AN", 9, 2, 6], ["FU", 7, [0, 1, 2, 3]], ["SP", 7, 0, 256, [1], 1], ["AN", 7, 1, 2], ["FFSP", 7, 0, [16, 15, 14, 13], 1, 1], ["AN", 7, 1, 6], ["FU", 5, [0, 1, 2, 3]], ["SP", 5, 0, 64, [1], 1], ["AN", 5, 1, 2], ["FFSP", 5, 0, [16, 15, 14, 13], 1, 1], ["AN", 5, 1, 6], ["FU", 4, [0, 1, 2, 3]], ["SP", 4, 0, 8192, [32], 1], ["AN", 4, 0, 5], ["AN", 4, 1, 6], ["PR", 4, 0, "auto_unroll_max_step$16"], ["PR", 8, 0, "auto_unroll_max_step$64"], ["PR", 11, 0, "auto_unroll_max_step$512"]]]], "r": [[0.000160952], 0, 1.6615, 1649058674], "v": "v0.6"}
{"i": [["[\"ad6cecbf5d85cb1cda3c2bb7af170211\", 1, 7, 7, 512, 4, 4, 512, 512, 1, 7, 7, 512, 1, 1, 1, 512, 1, 1, 1, 512, 1, 7, 7, 512]", "cuda -keys=cuda,gpu -max_num_threads=1024 -thread_warp_size=32", [-1, 16, 64, 2147483647, 2147483647, 1024, 8, 32], "", 0, []], [[], [["CI", 15], ["CI", 13], ["CI", 11], ["CI", 9], ["AN", 8, 0, 1], ["AN", 8, 1, 1], ["SP", 8, 2, 16, [16], 1], ["SP", 8, 4, 512, [4], 1], ["AN", 8, 6, 1], ["AN", 8, 7, 1], ["RE", 8, [2, 4, 3, 5, 0, 1, 6, 7]], ["CI", 7], ["CHW", 6, "local"], ["SP", 6, 0, 4, [1, 1, 2, 1], 1], ["SP", 6, 5, 4, [2, 1, 1, 2], 1], ["SP", 6, 10, 16, [1, 8, 1, 1], 1], ["SP", 6, 15, 512, [4, 4, 4, 8], 1], ["SP", 6, 20, 512, [1, 1], 1], ["RE", 6, [0, 5, 10, 15, 1, 6, 11, 16, 2, 7, 12, 17, 20, 21, 3, 8, 13, 18, 22, 4, 9, 14, 19]], ["FSP", 7, 0, 13, 3], ["FSP", 7, 4, 14, 3], ["FSP", 7, 8, 15, 3], ["FSP", 7, 12, 16, 3], ["RE", 7, [0, 4, 8, 12, 1, 5, 9, 13, 2, 6, 10, 14, 3, 7, 11, 15]], ["CA", 6, 7, 11], ["CHR", 5, "shared", [6]], ["CA", 6, 7, 12], ["CHR", 4, "shared", [7]], ["CA", 5, 8, 12], ["AN", 4, 0, 1], ["AN", 4, 1, 1], ["SP", 4, 2, 16, [16], 1], ["SP", 4, 4, 512, [2], 1], ["AN", 4, 6, 1], ["AN", 4, 7, 1], ["RE", 4, [2, 4, 3, 5, 0, 1, 6, 7]], ["CI", 3], ["CA", 2, 4, 3], ["CI", 1], ["FU", 19, [0, 1, 2, 3]], ["SP", 19, 0, 25088, [32], 1], ["AN", 19, 0, 5], ["AN", 19, 1, 6], ["FU", 11, [0, 1, 2, 3]], ["SP", 11, 0, 8192, [32], 1], ["AN", 11, 0, 5], ["AN", 11, 1, 6], ["FU", 9, [0, 1, 2, 3]], ["AN", 9, 0, 5], ["FU", 9, [1, 2, 3, 4]], ["AN", 9, 1, 4], ["FU", 9, [2, 3, 4, 5]], ["AN", 9, 2, 6], ["FU", 7, [0, 1, 2, 3]], ["SP", 7, 0, 2048, [1], 1], ["AN", 7, 1, 2], ["FFSP", 7, 0, [16, 15, 14, 13], 1, 1], ["AN", 7, 1, 6], ["FU", 5, [0, 1, 2, 3]], ["SP", 5, 0, 32, [1], 1], ["AN", 5, 1, 2], ["FFSP", 5, 0, [16, 15, 14, 13], 1, 1], ["AN", 5, 1, 6], ["FU", 4, [0, 1, 2, 3]], ["SP", 4, 0, 8192, [32], 1], ["AN", 4, 0, 5], ["AN", 4, 1, 6], ["PR", 4, 0, "auto_unroll_max_step$0"], ["PR", 8, 0, "auto_unroll_max_step$64"], ["PR", 11, 0, "auto_unroll_max_step$16"]]]], "r": [[0.00644837], 0, 1.6283, 1649058675], "v": "v0.6"}
{"i": [["[\"ad6cecbf5d85cb1cda3c2bb7af170211\", 1, 7, 7, 512, 4, 4, 512, 512, 1, 7, 7, 512, 1, 1, 1, 512, 1, 1, 1, 512, 1, 7, 7, 512]", "cuda -keys=cuda,gpu -max_num_threads=1024 -thread_warp_size=32", [-1, 16, 64, 2147483647, 2147483647, 1024, 8, 32], "", 0, []], [[], [["CI", 15], ["CI", 13], ["CI", 11], ["CI", 9], ["AN", 8, 0, 1], ["AN", 8, 1, 1], ["SP", 8, 2, 16, [8], 1], ["SP", 8, 4, 512, [64], 1], ["AN", 8, 6, 1], ["AN", 8, 7, 1], ["RE", 8, [2, 4, 3, 5, 0, 1, 6, 7]], ["CI", 7], ["CHW", 6, "local"], ["SP", 6, 0, 4, [1, 2, 1, 1], 1], ["SP", 6, 5, 4, [1, 2, 1, 1], 1], ["SP", 6, 10, 16, [4, 1, 2, 2], 1], ["SP", 6, 15, 512, [2, 64, 2, 1], 1], ["SP", 6, 20, 512, [4, 2], 1], ["RE", 6, [0, 5, 10, 15, 1, 6, 11, 16, 2, 7, 12, 17, 20, 21, 3, 8, 13, 18, 22, 4, 9, 14, 19]], ["FSP", 7, 0, 13, 3], ["FSP", 7, 4, 14, 3], ["FSP", 7, 8, 15, 3], ["FSP", 7, 12, 16, 3], ["RE", 7, [0, 4, 8, 12, 1, 5, 9, 13, 2, 6, 10, 14, 3, 7, 11, 15]], ["CA", 6, 7, 11], ["CHR", 5, "shared", [6]], ["CA", 6, 7, 12], ["CHR", 4, "shared", [7]], ["CA", 5, 8, 12], ["AN", 4, 0, 1], ["AN", 4, 1, 1], ["SP", 4, 2, 16, [2], 1], ["SP", 4, 4, 512, [4], 1], ["AN", 4, 6, 1], ["AN", 4, 7, 1], ["RE", 4, [2, 4, 3, 5, 0, 1, 6, 7]], ["CI", 3], ["CA", 2, 4, 3], ["CI", 1], ["FU", 19, [0, 1, 2, 3]], ["SP", 19, 0, 25088, [32], 1], ["AN", 19, 0, 5], ["AN", 19, 1, 6], ["FU", 11, [0, 1, 2, 3]], ["SP", 11, 0, 8192, [32], 1], ["AN", 11, 0, 5], ["AN", 11, 1, 6], ["FU", 9, [0, 1, 2, 3]], ["AN", 9, 0, 5], ["FU", 9, [1, 2, 3, 4]], ["AN", 9, 1, 4], ["FU", 9, [2, 3, 4, 5]], ["AN", 9, 2, 6], ["FU", 7, [0, 1, 2, 3]], ["SP", 7, 0, 16, [1], 1], ["AN", 7, 1, 2], ["FFSP", 7, 0, [16, 15, 14, 13], 1, 1], ["AN", 7, 1, 6], ["FU", 5, [0, 1, 2, 3]], ["SP", 5, 0, 32, [1], 1], ["AN", 5, 1, 2], ["FFSP", 5, 0, [16, 15, 14, 13], 1, 1], ["AN", 5, 1, 6], ["FU", 4, [0, 1, 2, 3]], ["SP", 4, 0, 8192, [4], 1], ["AN", 4, 0, 5], ["AN", 4, 1, 6], ["PR", 4, 0, "auto_unroll_max_step$512"], ["PR", 8, 0, "auto_unroll_max_step$1024"], ["PR", 11, 0, "auto_unroll_max_step$64"]]]], "r": [[0.000207982], 0, 1.727, 1649058676], "v": "v0.6"}
{"i": [["[\"3a69f9fbc63760d99e36b4c17b3bfc57\", 1, 7, 7, 512, 4, 4, 512, 512, 1, 1, 1, 512, 1, 7, 7, 512]", "cuda -keys=cuda,gpu -max_num_threads=1024 -thread_warp_size=32", [-1, 16, 64, 2147483647, 2147483647, 1024, 8, 32], "", 0, []], [[], [["CI", 11], ["CI", 9], ["AN", 8, 0, 1], ["AN", 8, 1, 1], ["SP", 8, 2, 16, [16], 1], ["SP", 8, 4, 512, [8], 1], ["AN", 8, 6, 1], ["AN", 8, 7, 1], ["RE", 8, [2, 4, 3, 5, 0, 1, 6, 7]], ["CI", 7], ["CHW", 6, "local"], ["SP", 6, 0, 4, [1, 1, 1, 4], 1], ["SP", 6, 5, 4, [1, 2, 2, 1], 1], ["SP", 6, 10, 16, [1, 4, 2, 1], 1], ["SP", 6, 15, 512, [4, 4, 1, 4], 1], ["SP", 6, 20, 512, [2, 2], 1], ["RE", 6, [0, 5, 10, 15, 1, 6, 11, 16, 2, 7, 12, 17, 20, 21, 3, 8, 13, 18, 22, 4, 9, 14, 19]], ["FSP", 7, 0, 11, 3], ["FSP", 7, 4, 12, 3], ["FSP", 7, 8, 13, 3], ["FSP", 7, 12, 14, 3], ["RE", 7, [0, 4, 8, 12, 1, 5, 9, 13, 2, 6, 10, 14, 3, 7, 11, 15]], ["CA", 6, 7, 11], ["CHR", 5, "shared", [6]], ["CA", 6, 7, 12], ["CHR", 4, "shared", [7]], ["CA", 5, 8, 12], ["AN", 4, 0, 1], ["AN", 4, 1, 1], ["SP", 4, 2, 16, [4], 1], ["SP", 4, 4, 512, [32], 1], ["AN", 4, 6, 1], ["AN", 4, 7, 1], ["RE", 4, [2, 4, 3, 5, 0, 1, 6, 7]], ["CI", 3], ["CA", 2, 4, 3], ["CI", 1], ["FU", 15, [0, 1, 2, 3]], ["SP", 15, 0, 25088, [32], 1], ["AN", 15, 0, 5], ["AN", 15, 1, 6], ["FU", 11, [0, 1, 2, 3]], ["SP", 11, 0, 8192, [32], 1], ["AN", 11, 0, 5], ["AN", 11, 1, 6], ["FU", 9, [0, 1, 2, 3]], ["AN", 9, 0, 5], ["FU", 9, [1, 2, 3, 4]], ["AN", 9, 1, 4], ["FU", 9, [2, 3, 4, 5]], ["AN", 9, 2, 6], ["FU", 7, [0, 1, 2, 3]], ["SP", 7, 0, 128, [1], 1], ["AN", 7, 1, 2], ["FFSP", 7, 0, [14, 13, 12, 11], 1, 1], ["AN", 7, 1, 6], ["FU", 5, [0, 1, 2, 3]], ["SP", 5, 0, 64, [1], 1], ["AN", 5, 1, 2], ["FFSP", 5, 0, [14, 13, 12, 11], 1, 1], ["AN", 5, 1, 6], ["FU", 4, [0, 1, 2, 3]], ["SP", 4, 0, 8192, [32], 1], ["AN", 4, 0, 5], ["AN", 4, 1, 6], ["PR", 4, 0, "auto_unroll_max_step$512"], ["PR", 8, 0, "auto_unroll_max_step$1024"], ["PR", 11, 0, "auto_unroll_max_step$1024"]]]], "r": [[0.000626723], 0, 2.77856, 1649058706], "v": "v0.6"}
{"i": [["[\"3a69f9fbc63760d99e36b4c17b3bfc57\", 1, 7, 7, 512, 4, 4, 512, 512, 1, 1, 1, 512, 1, 7, 7, 512]", "cuda -keys=cuda,gpu -max_num_threads=1024 -thread_warp_size=32", [-1, 16, 64, 2147483647, 2147483647, 1024, 8, 32], "", 0, []], [[], [["CI", 11], ["CI", 9], ["AN", 8, 0, 1], ["AN", 8, 1, 1], ["SP", 8, 2, 16, [2], 1], ["SP", 8, 4, 512, [2], 1], ["AN", 8, 6, 1], ["AN", 8, 7, 1], ["RE", 8, [2, 4, 3, 5, 0, 1, 6, 7]], ["CI", 7], ["CHW", 6, "local"], ["SP", 6, 0, 4, [1, 2, 1, 1], 1], ["SP", 6, 5, 4, [1, 1, 1, 1], 1], ["SP", 6, 10, 16, [2, 2, 2, 2], 1], ["SP", 6, 15, 512, [2, 32, 2, 2], 1], ["SP", 6, 20, 512, [4, 4], 1], ["RE", 6, [0, 5, 10, 15, 1, 6, 11, 16, 2, 7, 12, 17, 20, 21, 3, 8, 13, 18, 22, 4, 9, 14, 19]], ["FSP", 7, 0, 11, 3], ["FSP", 7, 4, 12, 3], ["FSP", 7, 8, 13, 3], ["FSP", 7, 12, 14, 3], ["RE", 7, [0, 4, 8, 12, 1, 5, 9, 13, 2, 6, 10, 14, 3, 7, 11, 15]], ["CA", 6, 7, 11], ["CHR", 5, "shared", [6]], ["CA", 6, 7, 12], ["CHR", 4, "shared", [7]], ["CA", 5, 8, 12], ["AN", 4, 0, 1], ["AN", 4, 1, 1], ["SP", 4, 2, 16, [2], 1], ["SP", 4, 4, 512, [64], 1], ["AN", 4, 6, 1], ["AN", 4, 7, 1], ["RE", 4, [2, 4, 3, 5, 0, 1, 6, 7]], ["CI", 3], ["CA", 2, 4, 3], ["CI", 1], ["FU", 15, [0, 1, 2, 3]], ["SP", 15, 0, 25088, [64], 1], ["AN", 15, 0, 5], ["AN", 15, 1, 6], ["FU", 11, [0, 1, 2, 3]], ["SP", 11, 0, 8192, [32], 1], ["AN", 11, 0, 5], ["AN", 11, 1, 6], ["FU", 9, [0, 1, 2, 3]], ["AN", 9, 0, 5], ["FU", 9, [1, 2, 3, 4]], ["AN", 9, 1, 4], ["FU", 9, [2, 3, 4, 5]], ["AN", 9, 2, 6], ["FU", 7, [0, 1, 2, 3]], ["SP", 7, 0, 64, [1], 1], ["AN", 7, 1, 2], ["FFSP", 7, 0, [14, 13, 12, 11], 1, 1], ["AN", 7, 1, 6], ["FU", 5, [0, 1, 2, 3]], ["SP", 5, 0, 64, [32], 1], ["AN", 5, 1, 2], ["FFSP", 5, 0, [14, 13, 12, 11], 1, 1], ["AN", 5, 1, 6], ["FU", 4, [0, 1, 2, 3]], ["SP", 4, 0, 8192, [32], 1], ["AN", 4, 0, 5], ["AN", 4, 1, 6], ["PR", 4, 0, "auto_unroll_max_step$64"], ["PR", 8, 0, "auto_unroll_max_step$64"], ["PR", 11, 0, "auto_unroll_max_step$64"]]]], "r": [[0.000186095], 0, 1.59793, 1649058708], "v": "v0.6"}
{"i": [["[\"3a69f9fbc63760d99e36b4c17b3bfc57\", 1, 7, 7, 512, 4, 4, 512, 512, 1, 1, 1, 512, 1, 7, 7, 512]", "cuda -keys=cuda,gpu -max_num_threads=1024 -thread_warp_size=32", [-1, 16, 64, 2147483647, 2147483647, 1024, 8, 32], "", 0, []], [[], [["CI", 11], ["CI", 9], ["AN", 8, 0, 1], ["AN", 8, 1, 1], ["SP", 8, 2, 16, [16], 1], ["SP", 8, 4, 512, [4], 1], ["AN", 8, 6, 1], ["AN", 8, 7, 1], ["RE", 8, [2, 4, 3, 5, 0, 1, 6, 7]], ["CI", 7], ["CHW", 6, "local"], ["SP", 6, 0, 4, [1, 1, 1, 1], 1], ["SP", 6, 5, 4, [1, 2, 1, 1], 1], ["SP", 6, 10, 16, [1, 1, 1, 1], 1], ["SP", 6, 15, 512, [1, 64, 1, 2], 1], ["SP", 6, 20, 512, [2, 1], 1], ["RE", 6, [0, 5, 10, 15, 1, 6, 11, 16, 2, 7, 12, 17, 20, 21, 3, 8, 13, 18, 22, 4, 9, 14, 19]], ["FSP", 7, 0, 11, 3], ["FSP", 7, 4, 12, 3], ["FSP", 7, 8, 13, 3], ["FSP", 7, 12, 14, 3], ["RE", 7, [0, 4, 8, 12, 1, 5, 9, 13, 2, 6, 10, 14, 3, 7, 11, 15]], ["CA", 6, 7, 11], ["CHR", 5, "shared", [6]], ["CA", 6, 7, 12], ["CHR", 4, "shared", [7]], ["CA", 5, 8, 12], ["AN", 4, 0, 1], ["AN", 4, 1, 1], ["SP", 4, 2, 16, [1], 1], ["SP", 4, 4, 512, [64], 1], ["AN", 4, 6, 1], ["AN", 4, 7, 1], ["RE", 4, [2, 4, 3, 5, 0, 1, 6, 7]], ["CI", 3], ["CA", 2, 4, 3], ["CI", 1], ["FU", 15, [0, 1, 2, 3]], ["SP", 15, 0, 25088, [32], 1], ["AN", 15, 0, 5], ["AN", 15, 1, 6], ["FU", 11, [0, 1, 2, 3]], ["SP", 11, 0, 8192, [32], 1], ["AN", 11, 0, 5], ["AN", 11, 1, 6], ["FU", 9, [0, 1, 2, 3]], ["AN", 9, 0, 5], ["FU", 9, [1, 2, 3, 4]], ["AN", 9, 1, 4], ["FU", 9, [2, 3, 4, 5]], ["AN", 9, 2, 6], ["FU", 7, [0, 1, 2, 3]], ["SP", 7, 0, 64, [1], 1], ["AN", 7, 1, 2], ["FFSP", 7, 0, [14, 13, 12, 11], 1, 1], ["AN", 7, 1, 6], ["FU", 5, [0, 1, 2, 3]], ["SP", 5, 0, 32, [1], 1], ["AN", 5, 1, 2], ["FFSP", 5, 0, [14, 13, 12, 11], 1, 1], ["AN", 5, 1, 6], ["FU", 4, [0, 1, 2, 3]], ["SP", 4, 0, 8192, [32], 1], ["AN", 4, 0, 5], ["AN", 4, 1, 6], ["PR", 4, 0, "auto_unroll_max_step$16"], ["PR", 8, 0, "auto_unroll_max_step$64"], ["PR", 11, 0, "auto_unroll_max_step$1024"]]]], "r": [[0.00128253], 0, 0.893212, 1649058709], "v": "v0.6"}
{"i": [["[\"d730bcd28f0920f6b97245e2a11bd8d6\", 1, 7, 7, 512, 4, 4, 512, 512, 1, 7, 7, 512, 1, 7, 7, 512]", "cuda -keys=cuda,gpu -max_num_threads=1024 -thread_warp_size=32", [-1, 16, 64, 2147483647, 2147483647, 1024, 8, 32], "", 0, []], [[], [["CI", 9], ["AN", 8, 0, 1], ["AN", 8, 1, 1], ["SP", 8, 2, 16, [4], 1], ["SP", 8, 4, 512, [32], 1], ["AN", 8, 6, 1], ["AN", 8, 7, 1], ["RE", 8, [2, 4, 3, 5, 0, 1, 6, 7]], ["CI", 7], ["CHW", 6, "local"], ["SP", 6, 0, 4, [1, 1, 2, 2], 1], ["SP", 6, 5, 4, [1, 1, 2, 1], 1], ["SP", 6, 10, 16, [1, 4, 1, 1], 1], ["SP", 6, 15, 512, [1, 8, 2, 2], 1], ["SP", 6, 20, 512, [4, 8], 1], ["RE", 6, [0, 5, 10, 15, 1, 6, 11, 16, 2, 7, 12, 17, 20, 21, 3, 8, 13, 18, 22, 4, 9, 14, 19]], ["FSP", 7, 0, 10, 3], ["FSP", 7, 4, 11, 3], ["FSP", 7, 8, 12, 3], ["FSP", 7, 12, 13, 3], ["RE", 7, [0, 4, 8, 12, 1, 5, 9, 13, 2, 6, 10, 14, 3, 7, 11, 15]], ["CA", 6, 7, 11], ["CHR", 5, "shared", [6]], ["CA", 6, 7, 12], ["CHR", 4, "shared", [7]], ["CA", 5, 8, 12], ["AN", 4, 0, 1], ["AN", 4, 1, 1], ["SP", 4, 2, 16, [8], 1], ["SP", 4, 4, 512, [8], 1], ["AN", 4, 6, 1], ["AN", 4, 7, 1], ["RE", 4, [2, 4, 3, 5, 0, 1, 6, 7]], ["CI", 3], ["CA", 2, 4, 3], ["CI", 1], ["FU", 14, [0, 1, 2, 3]], ["SP", 14, 0, 25088, [32], 1], ["AN", 14, 0, 5], ["AN", 14, 1, 6], ["FU", 11, [0, 1, 2, 3]], ["SP", 11, 0, 8192, [32], 1], ["AN", 11, 0, 5], ["AN", 11, 1, 6], ["FU", 9, [0, 1, 2, 3]], ["AN", 9, 0, 5], ["FU", 9, [1, 2, 3, 4]], ["AN", 9, 1, 4], ["FU", 9, [2, 3, 4, 5]], ["AN", 9, 2, 6], ["FU", 7, [0, 1, 2, 3]], ["SP", 7, 0, 1024, [1], 1], ["AN", 7, 1, 2], ["FFSP", 7, 0, [13, 12, 11, 10], 1, 1], ["AN", 7, 1, 6], ["FU", 5, [0, 1, 2, 3]], ["SP", 5, 0, 256, [1], 1], ["AN", 5, 1, 2], ["FFSP", 5, 0, [13, 12, 11, 10], 1, 1], ["AN", 5, 1, 6], ["FU", 4, [0, 1, 2, 3]], ["SP", 4, 0, 8192, [32], 1], ["AN", 4, 0, 5], ["AN", 4, 1, 6], ["PR", 4, 0, "auto_unroll_max_step$64"], ["PR", 8, 0, "auto_unroll_max_step$64"], ["PR", 11, 0, "auto_unroll_max_step$64"]]]], "r": [[0.000924993], 0, 1.43705, 1649058740], "v": "v0.6"}
{"i": [["[\"12b88bedece6984af589a28b43e0f3c4\", 1, 14, 14, 256, 3, 3, 256, 512, 1, 1, 1, 512, 1, 7, 7, 512]", "cuda -keys=cuda,gpu -max_num_threads=1024 -thread_warp_size=32", [-1, 16, 64, 2147483647, 2147483647, 1024, 8, 32], "", 0, []], [[], [["CI", 5], ["SP", 3, 0, 1, [1, 1, 1, 1], 1], ["SP", 3, 5, 7, [1, 1, 7, 1], 1], ["SP", 3, 10, 7, [1, 7, 1, 1], 1], ["SP", 3, 15, 512, [2, 32, 1, 2], 1], ["SP", 3, 20, 3, [1, 1], 1], ["SP", 3, 23, 3, [1, 1], 1], ["SP", 3, 26, 256, [4, 8], 1], ["RE", 3, [0, 5, 10, 15, 1, 6, 11, 16, 2, 7, 12, 17, 20, 23, 26, 21, 24, 27, 3, 8, 13, 18, 22, 25, 28, 4, 9, 14, 19]], ["FSP", 6, 0, 1, 3], ["FSP", 6, 4, 2, 3], ["FSP", 6, 8, 3, 3], ["FSP", 6, 12, 4, 3], ["RE", 6, [0, 4, 8, 12, 1, 5, 9, 13, 2, 6, 10, 14, 3, 7, 11, 15]], ["CA", 3, 6, 11], ["CHR", 2, "shared", [3]], ["CA", 3, 4, 14], ["CHR", 1, "shared", [4]], ["CA", 2, 5, 14], ["CI", 1], ["FU", 8, [0, 1, 2, 3]], ["AN", 8, 0, 5], ["FU", 8, [1, 2, 3, 4]], ["AN", 8, 1, 4], ["FU", 8, [2, 3, 4, 5]], ["AN", 8, 2, 6], ["FU", 4, [0, 1, 2, 3]], ["SP", 4, 0, 192, [8], 1], ["AN", 4, 1, 2], ["FFSP", 4, 0, [4, 3, 2, 1], 1, 1], ["AN", 4, 1, 6], ["FU", 2, [0, 1, 2, 3]], ["SP", 2, 0, 480, [1], 1], ["AN", 2, 1, 2], ["FFSP", 2, 0, [4, 3, 2, 1], 1, 1], ["AN", 2, 1, 6], ["PR", 5, 0, "auto_unroll_max_step$1024"]]]], "r": [[0.000251817], 0, 1.79338, 1649058755], "v": "v0.6"}
{"i": [["[\"12b88bedece6984af589a28b43e0f3c4\", 1, 14, 14, 256, 3, 3, 256, 512, 1, 1, 1, 512, 1, 7, 7, 512]", "cuda -keys=cuda,gpu -max_num_threads=1024 -thread_warp_size=32", [-1, 16, 64, 2147483647, 2147483647, 1024, 8, 32], "", 0, []], [[], [["CI", 5], ["SP", 3, 0, 1, [1, 1, 1, 1], 1], ["SP", 3, 5, 7, [1, 1, 1, 1], 1], ["SP", 3, 10, 7, [1, 1, 7, 1], 1], ["SP", 3, 15, 512, [8, 16, 1, 4], 1], ["SP", 3, 20, 3, [3, 1], 1], ["SP", 3, 23, 3, [1, 1], 1], ["SP", 3, 26, 256, [2, 1], 1], ["RE", 3, [0, 5, 10, 15, 1, 6, 11, 16, 2, 7, 12, 17, 20, 23, 26, 21, 24, 27, 3, 8, 13, 18, 22, 25, 28, 4, 9, 14, 19]], ["FSP", 6, 0, 1, 3], ["FSP", 6, 4, 2, 3], ["FSP", 6, 8, 3, 3], ["FSP", 6, 12, 4, 3], ["RE", 6, [0, 4, 8, 12, 1, 5, 9, 13, 2, 6, 10, 14, 3, 7, 11, 15]], ["CA", 3, 6, 11], ["CHR", 2, "shared", [3]], ["CA", 3, 4, 14], ["CHR", 1, "shared", [4]], ["CA", 2, 5, 14], ["CI", 1], ["FU", 8, [0, 1, 2, 3]], ["AN", 8, 0, 5], ["FU", 8, [1, 2, 3, 4]], ["AN", 8, 1, 4], ["FU", 8, [2, 3, 4, 5]], ["AN", 8, 2, 6], ["FU", 4, [0, 1, 2, 3]], ["SP", 4, 0, 4, [1], 1], ["AN", 4, 1, 2], ["FFSP", 4, 0, [4, 3, 2, 1], 1, 1], ["AN", 4, 1, 6], ["FU", 2, [0, 1, 2, 3]], ["SP", 2, 0, 26, [1], 1], ["AN", 2, 1, 2], ["FFSP", 2, 0, [4, 3, 2, 1], 1, 1], ["AN", 2, 1, 6], ["PR", 5, 0, "auto_unroll_max_step$64"]]]], "r": [[0.00401261], 0, 1.01712, 1649058756], "v": "v0.6"}
{"i": [["[\"f3b6c10fcc6ce01ff01add933e4d21e9\", 1, 14, 14, 256, 4, 4, 256, 256, 1, 14, 14, 256, 1, 1, 1, 256, 1, 14, 14, 256]", "cuda -keys=cuda,gpu -max_num_threads=1024 -thread_warp_size=32", [-1, 16, 64, 2147483647, 2147483647, 1024, 8, 32], "", 0, []], [[], [["CI", 13], ["CI", 11], ["CI", 9], ["AN", 8, 0, 1], ["AN", 8, 1, 1], ["SP", 8, 2, 49, [1], 1], ["SP", 8, 4, 256, [2], 1], ["AN", 8, 6, 1], ["AN", 8, 7, 1], ["RE", 8, [2, 4, 3, 5, 0, 1, 6, 7]], ["CI", 7], ["CHW", 6, "local"], ["SP", 6, 0, 4, [1, 2, 1, 1], 1], ["SP", 6, 5, 4, [1, 1, 2, 2], 1], ["SP", 6, 10, 49, [1, 1, 49, 1], 1], ["SP", 6, 15, 256, [4, 16, 2, 2], 1], ["SP", 6, 20, 256, [2, 1], 1], ["RE", 6, [0, 5, 10, 15, 1, 6, 11, 16, 2, 7, 12, 17, 20, 21, 3, 8, 13, 18, 22, 4, 9, 14, 19]], ["FSP", 7, 0, 12, 3], ["FSP", 7, 4, 13, 3], ["FSP", 7, 8, 14, 3], ["FSP", 7, 12, 15, 3], ["RE", 7, [0, 4, 8, 12, 1, 5, 9, 13, 2, 6, 10, 14, 3, 7, 11, 15]], ["CA", 6, 7, 11], ["CHR", 5, "shared", [6]], ["CA", 6, 7, 12], ["CHR", 4, "shared", [7]], ["CA", 5, 8, 12], ["AN", 4, 0, 1], ["AN", 4, 1, 1], ["SP", 4, 2, 49, [49], 1], ["SP", 4, 4, 256, [1], 1], ["AN", 4, 6, 1], ["AN", 4, 7, 1], ["RE", 4, [2, 4, 3, 5, 0, 1, 6, 7]], ["CI", 3], ["CA", 2, 4, 3], ["CI", 1], ["FU", 17, [0, 1, 2, 3]], ["SP", 17, 0, 50176, [16], 1], ["AN", 17, 0, 5], ["AN", 17, 1, 6], ["FU", 11, [0, 1, 2, 3]], ["SP", 11, 0, 12544, [32], 1], ["AN", 11, 0, 5], ["AN", 11, 1, 6], ["FU", 9, [0, 1, 2, 3]], ["AN", 9, 0, 5], ["FU", 9, [1, 2, 3, 4]], ["AN", 9, 1, 4], ["FU", 9, [2, 3, 4, 5]], ["AN", 9, 2, 6], ["FU", 7, [0, 1, 2, 3]], ["SP", 7, 0, 128, [1], 1], ["AN", 7, 1, 2], ["FFSP", 7, 0, [15, 14, 13, 12], 1, 1], ["AN", 7, 1, 6], ["FU", 5, [0, 1, 2, 3]], ["SP", 5, 0, 1568, [1], 1], ["AN", 5, 1, 2], ["FFSP", 5, 0, [15, 14, 13, 12], 1, 1], ["AN", 5, 1, 6], ["FU", 4, [0, 1, 2, 3]], ["SP", 4, 0, 12544, [2], 1], ["AN", 4, 0, 5], ["AN", 4, 1, 6], ["PR", 4, 0, "auto_unroll_max_step$64"], ["PR", 8, 0, "auto_unroll_max_step$512"], ["PR", 11, 0, "auto_unroll_max_step$1024"]]]], "r": [[0.00963897], 0, 1.54263, 1649058792], "v": "v0.6"}
{"i": [["[\"b8b52b9be9df6102466a22a014c44c1f\", 1, 14, 14, 256, 4, 4, 256, 256, 1, 1, 1, 256, 1, 14, 14, 256]", "cuda -keys=cuda,gpu -max_num_threads=1024 -thread_warp_size=32", [-1, 16, 64, 2147483647, 2147483647, 1024, 8, 32], "", 0, []], [[], [["CI", 11], ["CI", 9], ["AN", 8, 0, 1], ["AN", 8, 1, 1], ["SP", 8, 2, 49, [1], 1], ["SP", 8, 4, 256, [16], 1], ["AN", 8, 6, 1], ["AN", 8, 7, 1], ["RE", 8, [2, 4, 3, 5, 0, 1, 6, 7]], ["CI", 7], ["CHW", 6, "local"], ["SP", 6, 0, 4, [1, 1, 2, 1], 1], ["SP", 6, 5, 4, [1, 1, 1, 2], 1], ["SP", 6, 10, 49, [1, 1, 7, 7], 1], ["SP", 6, 15, 256, [1, 8, 4, 1], 1], ["SP", 6, 20, 256, [1, 1], 1], ["RE", 6, [0, 5, 10, 15, 1, 6, 11, 16, 2, 7, 12, 17, 20, 21, 3, 8, 13, 18, 22, 4, 9, 14, 19]], ["FSP", 7, 0, 11, 3], ["FSP", 7, 4, 12, 3], ["FSP", 7, 8, 13, 3], ["FSP", 7, 12, 14, 3], ["RE", 7, [0, 4, 8, 12, 1, 5, 9, 13, 2, 6, 10, 14, 3, 7, 11, 15]], ["CA", 6, 7, 11], ["CHR", 5, "shared", [6]], ["CA", 6, 7, 12], ["CHR", 4, "shared", [7]], ["CA", 5, 8, 12], ["AN", 4, 0, 1], ["AN", 4, 1, 1], ["SP", 4, 2, 49, [7], 1], ["SP", 4, 4, 256, [64], 1], ["AN", 4, 6, 1], ["AN", 4, 7, 1], ["RE", 4, [2, 4, 3, 5, 0, 1, 6, 7]], ["CI", 3], ["CA", 2, 4, 3], ["CI", 1], ["FU", 15, [0, 1, 2, 3]], ["SP", 15, 0, 50176, [32], 1], ["AN", 15, 0, 5], ["AN", 15, 1, 6], ["FU", 11, [0, 1, 2, 3]], ["SP", 11, 0, 12544, [32], 1], ["AN", 11, 0, 5], ["AN", 11, 1, 6], ["FU", 9, [0, 1, 2, 3]], ["AN", 9, 0, 5], ["FU", 9, [1, 2, 3, 4]], ["AN", 9, 1, 4], ["FU", 9, [2, 3, 4, 5]], ["AN", 9, 2, 6], ["FU", 7, [0, 1, 2, 3]], ["SP", 7, 0, 16, [1], 1], ["AN", 7, 1, 2], ["FFSP", 7, 0, [14, 13, 12, 11], 1, 1], ["AN", 7, 1, 6], ["FU", 5, [0, 1, 2, 3]], ["SP", 5, 0, 28, [28], 1], ["AN", 5, 1, 2], ["FFSP", 5, 0, [14, 13, 12, 11], 1, 1], ["AN", 5, 1, 6], ["FU", 4, [0, 1, 2, 3]], ["SP", 4, 0, 12544, [32], 1], ["AN", 4, 0, 5], ["AN", 4, 1, 6], ["PR", 4, 0, "auto_unroll_max_step$64"], ["PR", 8, 0, "auto_unroll_max_step$16"], ["PR", 11, 0, "auto_unroll_max_step$64"]]]], "r": [[0.00292077], 0, 1.69854, 1649058821], "v": "v0.6"}
{"i": [["[\"b8b52b9be9df6102466a22a014c44c1f\", 1, 14, 14, 256, 4, 4, 256, 256, 1, 1, 1, 256, 1, 14, 14, 256]", "cuda -keys=cuda,gpu -max_num_threads=1024 -thread_warp_size=32", [-1, 16, 64, 2147483647, 2147483647, 1024, 8, 32], "", 0, []], [[], [["CI", 11], ["CI", 9], ["AN", 8, 0, 1], ["AN", 8, 1, 1], ["SP", 8, 2, 49, [49], 1], ["SP", 8, 4, 256, [64], 1], ["AN", 8, 6, 1], ["AN", 8, 7, 1], ["RE", 8, [2, 4, 3, 5, 0, 1, 6, 7]], ["CI", 7], ["CHW", 6, "local"], ["SP", 6, 0, 4, [2, 2, 1, 1], 1], ["SP", 6, 5, 4, [2, 1, 1, 2], 1], ["SP", 6, 10, 49, [1, 7, 1, 1], 1], ["SP", 6, 15, 256, [2, 4, 2, 1], 1], ["SP", 6, 20, 256, [2, 4], 1], ["RE", 6, [0, 5, 10, 15, 1, 6, 11, 16, 2, 7, 12, 17, 20, 21, 3, 8, 13, 18, 22, 4, 9, 14, 19]], ["FSP", 7, 0, 11, 3], ["FSP", 7, 4, 12, 3], ["FSP", 7, 8, 13, 3], ["FSP", 7, 12, 14, 3], ["RE", 7, [0, 4, 8, 12, 1, 5, 9, 13, 2, 6, 10, 14, 3, 7, 11, 15]], ["CA", 6, 7, 11], ["CHR", 5, "shared", [6]], ["CA", 6, 7, 12], ["CHR", 4, "shared", [7]], ["CA", 5, 8, 12], ["AN", 4, 0, 1], ["AN", 4, 1, 1], ["SP", 4, 2, 49, [1], 1], ["SP", 4, 4, 256, [32], 1], ["AN", 4, 6, 1], ["AN", 4, 7, 1], ["RE", 4, [2, 4, 3, 5, 0, 1, 6, 7]], ["CI", 3], ["CA", 2, 4, 3], ["CI", 1], ["FU", 15, [0, 1, 2, 3]], ["SP", 15, 0, 50176, [32], 1], ["AN", 15, 0, 5], ["AN", 15, 1, 6], ["FU", 11, [0, 1, 2, 3]], ["SP", 11, 0, 12544, [32], 1], ["AN", 11, 0, 5], ["AN", 11, 1, 6], ["FU", 9, [0, 1, 2, 3]], ["AN", 9, 0, 5], ["FU", 9, [1, 2, 3, 4]], ["AN", 9, 1, 4], ["FU", 9, [2, 3, 4, 5]], ["AN", 9, 2, 6], ["FU", 7, [0, 1, 2, 3]], ["SP", 7, 0, 64, [1], 1], ["AN", 7, 1, 2], ["FFSP", 7, 0, [14, 13, 12, 11], 1, 1], ["AN", 7, 1, 6], ["FU", 5, [0, 1, 2, 3]], ["SP", 5, 0, 16, [1], 1], ["AN", 5, 1, 2], ["FFSP", 5, 0, [14, 13, 12, 11], 1, 1], ["AN", 5, 1, 6], ["FU", 4, [0, 1, 2, 3]], ["SP", 4, 0, 12544, [32], 1], ["AN", 4, 0, 5], ["AN", 4, 1, 6], ["PR", 4, 0, "auto_unroll_max_step$64"], ["PR", 8, 0, "auto_unroll_max_step$16"], ["PR", 11, 0, "auto_unroll_max_step$512"]]]], "r": [[0.000211779], 0, 1.36298, 1649058822], "v": "v0.6"}
{"i": [["[\"b8b52b9be9df6102466a22a014c44c1f\", 1, 14, 14, 256, 4, 4, 256, 256, 1, 1, 1, 256, 1, 14, 14, 256]", "cuda -keys=cuda,gpu -max_num_threads=1024 -thread_warp_size=32", [-1, 16, 64, 2147483647, 2147483647, 1024, 8, 32], "", 0, []], [[], [["CI", 11], ["CI", 9], ["AN", 8, 0, 1], ["AN", 8, 1, 1], ["SP", 8, 2, 49, [7], 1], ["SP", 8, 4, 256, [16], 1], ["AN", 8, 6, 1], ["AN", 8, 7, 1], ["RE", 8, [2, 4, 3, 5, 0, 1, 6, 7]], ["CI", 7], ["CHW", 6, "local"], ["SP", 6, 0, 4, [2, 1, 1, 1], 1], ["SP", 6, 5, 4, [1, 4, 1, 1], 1], ["SP", 6, 10, 49, [1, 7, 1, 1], 1], ["SP", 6, 15, 256, [2, 8, 1, 2], 1], ["SP", 6, 20, 256, [32, 1], 1], ["RE", 6, [0, 5, 10, 15, 1, 6, 11, 16, 2, 7, 12, 17, 20, 21, 3, 8, 13, 18, 22, 4, 9, 14, 19]], ["FSP", 7, 0, 11, 3], ["FSP", 7, 4, 12, 3], ["FSP", 7, 8, 13, 3], ["FSP", 7, 12, 14, 3], ["RE", 7, [0, 4, 8, 12, 1, 5, 9, 13, 2, 6, 10, 14, 3, 7, 11, 15]], ["CA", 6, 7, 11], ["CHR", 5, "shared", [6]], ["CA", 6, 7, 12], ["CHR", 4, "shared", [7]], ["CA", 5, 8, 12], ["AN", 4, 0, 1], ["AN", 4, 1, 1], ["SP", 4, 2, 49, [1], 1], ["SP", 4, 4, 256, [4], 1], ["AN", 4, 6, 1], ["AN", 4, 7, 1], ["RE", 4, [2, 4, 3, 5, 0, 1, 6, 7]], ["CI", 3], ["CA", 2, 4, 3], ["CI", 1], ["FU", 15, [0, 1, 2, 3]], ["SP", 15, 0, 50176, [32], 1], ["AN", 15, 0, 5], ["AN", 15, 1, 6], ["FU", 11, [0, 1, 2, 3]], ["SP", 11, 0, 12544, [32], 1], ["AN", 11, 0, 5], ["AN", 11, 1, 6], ["FU", 9, [0, 1, 2, 3]], ["AN", 9, 0, 5], ["FU", 9, [1, 2, 3, 4]], ["AN", 9, 1, 4], ["FU", 9, [2, 3, 4, 5]], ["AN", 9, 2, 6], ["FU", 7, [0, 1, 2, 3]], ["SP", 7, 0, 64, [1], 1], ["AN", 7, 1, 2], ["FFSP", 7, 0, [14, 13, 12, 11], 1, 1], ["AN", 7, 1, 6], ["FU", 5, [0, 1, 2, 3]], ["SP", 5, 0, 32, [1], 1], ["AN", 5, 1, 2], ["FFSP", 5, 0, [14, 13, 12, 11], 1, 1], ["AN", 5, 1, 6], ["FU", 4, [0, 1, 2, 3]], ["SP", 4, 0, 12544, [32], 1], ["AN", 4, 0, 5], ["AN", 4, 1, 6], ["PR", 4, 0, "auto_unroll_max_step$16"], ["PR", 8, 0, "auto_unroll_max_step$1024"], ["PR", 11, 0, "auto_unroll_max_step$64"]]]], "r": [[0.000461228], 0, 1.51488, 1649058824], "v": "v0.6"}
{"i": [["[\"d374e472bd9d8164892b9e28a0a8cb59\", 1, 14, 14, 256, 4, 4, 256, 256, 1, 14, 14, 256, 1, 14, 14, 256]", "cuda -keys=cuda,gpu -max_num_threads=1024 -thread_warp_size=32", [-1, 16, 64, 2147483647, 2147483647, 1024, 8, 32], "", 0, []], [[], [["CI", 9], ["AN", 8, 0, 1], ["AN", 8, 1, 1], ["SP", 8, 2, 49, [1], 1], ["SP", 8, 4, 256, [8], 1], ["AN", 8, 6, 1], ["AN", 8, 7, 1], ["RE", 8, [2, 4, 3, 5, 0, 1, 6, 7]], ["CI", 7], ["CHW", 6, "local"], ["SP", 6, 0, 4, [1, 1, 1, 4], 1], ["SP", 6, 5, 4, [1, 4, 1, 1], 1], ["SP", 6, 10, 49, [1, 1, 1, 1], 1], ["SP", 6, 15, 256, [2, 8, 4, 4], 1], ["SP", 6, 20, 256, [1, 2], 1], ["RE", 6, [0, 5, 10, 15, 1, 6, 11, 16, 2, 7, 12, 17, 20, 21, 3, 8, 13, 18, 22, 4, 9, 14, 19]], ["FSP", 7, 0, 10, 3], ["FSP", 7, 4, 11, 3], ["FSP", 7, 8, 12, 3], ["FSP", 7, 12, 13, 3], ["RE", 7, [0, 4, 8, 12, 1, 5, 9, 13, 2, 6, 10, 14, 3, 7, 11, 15]], ["CA", 6, 7, 11], ["CHR", 5, "shared", [6]], ["CA", 6, 7, 12], ["CHR", 4, "shared", [7]], ["CA", 5, 8, 12], ["AN", 4, 0, 1], ["AN", 4, 1, 1], ["SP", 4, 2, 49, [7], 1], ["SP", 4, 4, 256, [32], 1], ["AN", 4, 6, 1], ["AN", 4, 7, 1], ["RE", 4, [2, 4, 3, 5, 0, 1, 6, 7]], ["CI", 3], ["CA", 2, 4, 3], ["CI", 1], ["FU", 14, [0, 1, 2, 3]], ["SP", 14, 0, 50176, [32], 1], ["AN", 14, 0, 5], ["AN", 14, 1, 6], ["FU", 11, [0, 1, 2, 3]], ["SP", 11, 0, 12544, [32], 1], ["AN", 11, 0, 5], ["AN", 11, 1, 6], ["FU", 9, [0, 1, 2, 3]], ["AN", 9, 0, 5], ["FU", 9, [1, 2, 3, 4]], ["AN", 9, 1, 4], ["FU", 9, [2, 3, 4, 5]], ["AN", 9, 2, 6], ["FU", 7, [0, 1, 2, 3]], ["SP", 7, 0, 128, [4], 1], ["AN", 7, 1, 2], ["FFSP", 7, 0, [13, 12, 11, 10], 1, 1], ["AN", 7, 1, 6], ["FU", 5, [0, 1, 2, 3]], ["SP", 5, 0, 8, [1], 1], ["AN", 5, 1, 2], ["FFSP", 5, 0, [13, 12, 11, 10], 1, 1], ["AN", 5, 1, 6], ["FU", 4, [0, 1, 2, 3]], ["SP", 4, 0, 12544, [2], 1], ["AN", 4, 0, 5], ["AN", 4, 1, 6], ["PR", 4, 0, "auto_unroll_max_step$64"], ["PR", 8, 0, "auto_unroll_max_step$0"], ["PR", 11, 0, "auto_unroll_max_step$1024"]]]], "r": [[0.00410632], 0, 1.31857, 1649058853], "v": "v0.6"}
{"i": [["[\"c4500b4e2fd04e695c32d2f31bbdc14a\", 1, 28, 28, 128, 4, 4, 128, 128, 1, 28, 28, 128, 1, 1, 1, 128, 1, 28, 28, 128]", "cuda -keys=cuda,gpu -max_num_threads=1024 -thread_warp_size=32", [-1, 16, 64, 2147483647, 2147483647, 1024, 8, 32], "", 0, []], [[], [["CI", 13], ["CI", 11], ["CI", 9], ["AN", 8, 0, 1], ["AN", 8, 1, 1], ["SP", 8, 2, 196, [4], 1], ["SP", 8, 4, 128, [1], 1], ["AN", 8, 6, 1], ["AN", 8, 7, 1], ["RE", 8, [2, 4, 3, 5, 0, 1, 6, 7]], ["CI", 7], ["CHW", 6, "local"], ["SP", 6, 0, 4, [1, 1, 1, 1], 1], ["SP", 6, 5, 4, [1, 1, 1, 1], 1], ["SP", 6, 10, 196, [1, 28, 1, 1], 1], ["SP", 6, 15, 128, [2, 16, 1, 2], 1], ["SP", 6, 20, 128, [2, 1], 1], ["RE", 6, [0, 5, 10, 15, 1, 6, 11, 16, 2, 7, 12, 17, 20, 21, 3, 8, 13, 18, 22, 4, 9, 14, 19]], ["FSP", 7, 0, 12, 3], ["FSP", 7, 4, 13, 3], ["FSP", 7, 8, 14, 3], ["FSP", 7, 12, 15, 3], ["RE", 7, [0, 4, 8, 12, 1, 5, 9, 13, 2, 6, 10, 14, 3, 7, 11, 15]], ["CA", 6, 7, 11], ["CHR", 5, "shared", [6]], ["CA", 6, 7, 12], ["CHR", 4, "shared", [7]], ["CA", 5, 8, 12], ["AN", 4, 0, 1], ["AN", 4, 1, 1], ["SP", 4, 2, 196, [4], 1], ["SP", 4, 4, 128, [32], 1], ["AN", 4, 6, 1], ["AN", 4, 7, 1], ["RE", 4, [2, 4, 3, 5, 0, 1, 6, 7]], ["CI", 3], ["CA", 2, 4, 3], ["CI", 1], ["FU", 17, [0, 1, 2, 3]], ["SP", 17, 0, 100352, [32], 1], ["AN", 17, 0, 5], ["AN", 17, 1, 6], ["FU", 11, [0, 1, 2, 3]], ["SP", 11, 0, 25088, [32], 1], ["AN", 11, 0, 5], ["AN", 11, 1, 6], ["FU", 9, [0, 1, 2, 3]], ["AN", 9, 0, 5], ["FU", 9, [1, 2, 3, 4]], ["AN", 9, 1, 4], ["FU", 9, [2, 3, 4, 5]], ["AN", 9, 2, 6], ["FU", 7, [0, 1, 2, 3]], ["SP", 7, 0, 4, [2], 1], ["AN", 7, 1, 2], ["FFSP", 7, 0, [15, 14, 13, 12], 1, 1], ["AN", 7, 1, 6], ["FU", 5, [0, 1, 2, 3]], ["SP", 5, 0, 2, [1], 1], ["AN", 5, 1, 2], ["FFSP", 5, 0, [15, 14, 13, 12], 1, 1], ["AN", 5, 1, 6], ["FU", 4, [0, 1, 2, 3]], ["SP", 4, 0, 25088, [32], 1], ["AN", 4, 0, 5], ["AN", 4, 1, 6], ["PR", 4, 0, "auto_unroll_max_step$512"], ["PR", 8, 0, "auto_unroll_max_step$16"], ["PR", 11, 0, "auto_unroll_max_step$512"]]]], "r": [[0.000145105], 0, 1.18639, 1649058902], "v": "v0.6"}
{"i": [["[\"c4500b4e2fd04e695c32d2f31bbdc14a\", 1, 28, 28, 128, 4, 4, 128, 128, 1, 28, 28, 128, 1, 1, 1, 128, 1, 28, 28, 128]", "cuda -keys=cuda,gpu -max_num_threads=1024 -thread_warp_size=32", [-1, 16, 64, 2147483647, 2147483647, 1024, 8, 32], "", 0, []], [[], [["CI", 13], ["CI", 11], ["CI", 9], ["AN", 8, 0, 1], ["AN", 8, 1, 1], ["SP", 8, 2, 196, [49], 1], ["SP", 8, 4, 128, [2], 1], ["AN", 8, 6, 1], ["AN", 8, 7, 1], ["RE", 8, [2, 4, 3, 5, 0, 1, 6, 7]], ["CI", 7], ["CHW", 6, "local"], ["SP", 6, 0, 4, [2, 1, 2, 1], 1], ["SP", 6, 5, 4, [1, 1, 1, 2], 1], ["SP", 6, 10, 196, [1, 14, 1, 2], 1], ["SP", 6, 15, 128, [1, 2, 8, 1], 1], ["SP", 6, 20, 128, [1, 2], 1], ["RE", 6, [0, 5, 10, 15, 1, 6, 11, 16, 2, 7, 12, 17, 20, 21, 3, 8, 13, 18, 22, 4, 9, 14, 19]], ["FSP", 7, 0, 12, 3], ["FSP", 7, 4, 13, 3], ["FSP", 7, 8, 14, 3], ["FSP", 7, 12, 15, 3], ["RE", 7, [0, 4, 8, 12, 1, 5, 9, 13, 2, 6, 10, 14, 3, 7, 11, 15]], ["CA", 6, 7, 11], ["CHR", 5, "shared", [6]], ["CA", 6, 7, 12], ["CHR", 4, "shared", [7]], ["CA", 5, 8, 12], ["AN", 4, 0, 1], ["AN", 4, 1, 1], ["SP", 4, 2, 196, [14], 1], ["SP", 4, 4, 128, [4], 1], ["AN", 4, 6, 1], ["AN", 4, 7, 1], ["RE", 4, [2, 4, 3, 5, 0, 1, 6, 7]], ["CI", 3], ["CA", 2, 4, 3], ["CI", 1], ["FU", 17, [0, 1, 2, 3]], ["SP", 17, 0, 100352, [32], 1], ["AN", 17, 0, 5], ["AN", 17, 1, 6], ["FU", 11, [0, 1, 2, 3]], ["SP", 11, 0, 25088, [32], 1], ["AN", 11, 0, 5], ["AN", 11, 1, 6], ["FU", 9, [0, 1, 2, 3]], ["AN", 9, 0, 5], ["FU", 9, [1, 2, 3, 4]], ["AN", 9, 1, 4], ["FU", 9, [2, 3, 4, 5]], ["AN", 9, 2, 6], ["FU", 7, [0, 1, 2, 3]], ["SP", 7, 0, 64, [1], 1], ["AN", 7, 1, 2], ["FFSP", 7, 0, [15, 14, 13, 12], 1, 1], ["AN", 7, 1, 6], ["FU", 5, [0, 1, 2, 3]], ["SP", 5, 0, 16, [1], 1], ["AN", 5, 1, 2], ["FFSP", 5, 0, [15, 14, 13, 12], 1, 1], ["AN", 5, 1, 6], ["FU", 4, [0, 1, 2, 3]], ["SP", 4, 0, 25088, [32], 1], ["AN", 4, 0, 5], ["AN", 4, 1, 6], ["PR", 4, 0, "auto_unroll_max_step$1024"], ["PR", 8, 0, "auto_unroll_max_step$0"], ["PR", 11, 0, "auto_unroll_max_step$16"]]]], "r": [[0.000302356], 0, 1.46149, 1649058905], "v": "v0.6"}
{"i": [["[\"e4cdf917b876dbdd64488c3818d9c141\", 1, 28, 28, 128, 4, 4, 128, 128, 1, 1, 1, 128, 1, 28, 28, 128]", "cuda -keys=cuda,gpu -max_num_threads=1024 -thread_warp_size=32", [-1, 16, 64, 2147483647, 2147483647, 1024, 8, 32], "", 0, []], [[], [["CI", 11], ["CI", 9], ["AN", 8, 0, 1], ["AN", 8, 1, 1], ["SP", 8, 2, 196, [28], 1], ["SP", 8, 4, 128, [2], 1], ["AN", 8, 6, 1], ["AN", 8, 7, 1], ["RE", 8, [2, 4, 3, 5, 0, 1, 6, 7]], ["CI", 7], ["CHW", 6, "local"], ["SP", 6, 0, 4, [1, 1, 2, 1], 1], ["SP", 6, 5, 4, [1, 1, 1, 2], 1], ["SP", 6, 10, 196, [7, 1, 14, 2], 1], ["SP", 6, 15, 128, [2, 32, 2, 1], 1], ["SP", 6, 20, 128, [2, 2], 1], ["RE", 6, [0, 5, 10, 15, 1, 6, 11, 16, 2, 7, 12, 17, 20, 21, 3, 8, 13, 18, 22, 4, 9, 14, 19]], ["FSP", 7, 0, 11, 3], ["FSP", 7, 4, 12, 3], ["FSP", 7, 8, 13, 3], ["FSP", 7, 12, 14, 3], ["RE", 7, [0, 4, 8, 12, 1, 5, 9, 13, 2, 6, 10, 14, 3, 7, 11, 15]], ["CA", 6, 7, 11], ["CHR", 5, "shared", [6]], ["CA", 6, 7, 12], ["CHR", 4, "shared", [7]], ["CA", 5, 8, 12], ["AN", 4, 0, 1], ["AN", 4, 1, 1], ["SP", 4, 2, 196, [1], 1], ["SP", 4, 4, 128, [2], 1], ["AN", 4, 6, 1], ["AN", 4, 7, 1], ["RE", 4, [2, 4, 3, 5, 0, 1, 6, 7]], ["CI", 3], ["CA", 2, 4, 3], ["CI", 1], ["FU", 15, [0, 1, 2, 3]], ["SP", 15, 0, 100352, [32], 1], ["AN", 15, 0, 5], ["AN", 15, 1, 6], ["FU", 11, [0, 1, 2, 3]], ["SP", 11, 0, 25088, [32], 1], ["AN", 11, 0, 5], ["AN", 11, 1, 6], ["FU", 9, [0, 1, 2, 3]], ["AN", 9, 0, 5], ["FU", 9, [1, 2, 3, 4]], ["AN", 9, 1, 4], ["FU", 9, [2, 3, 4, 5]], ["AN", 9, 2, 6], ["FU", 7, [0, 1, 2, 3]], ["SP", 7, 0, 32, [1], 1], ["AN", 7, 1, 2], ["FFSP", 7, 0, [14, 13, 12, 11], 1, 1], ["AN", 7, 1, 6], ["FU", 5, [0, 1, 2, 3]], ["SP", 5, 0, 448, [1], 1], ["AN", 5, 1, 2], ["FFSP", 5, 0, [14, 13, 12, 11], 1, 1], ["AN", 5, 1, 6], ["FU", 4, [0, 1, 2, 3]], ["SP", 4, 0, 25088, [32], 1], ["AN", 4, 0, 5], ["AN", 4, 1, 6], ["PR", 4, 0, "auto_unroll_max_step$0"], ["PR", 8, 0, "auto_unroll_max_step$1024"], ["PR", 11, 0, "auto_unroll_max_step$16"]]]], "r": [[0.00194617], 0, 1.83582, 1649058937], "v": "v0.6"}
{"i": [["[\"dac19035dd5fe9424ee8617421b9c817\", 1, 28, 28, 128, 4, 4, 128, 128, 1, 28, 28, 128, 1, 28, 28, 128]", "cuda -keys=cuda,gpu -max_num_threads=1024 -thread_warp_size=32", [-1, 16, 64, 2147483647, 2147483647, 1024, 8, 32], "", 0, []], [[], [["CI", 9], ["AN", 8, 0, 1], ["AN", 8, 1, 1], ["SP", 8, 2, 196, [14], 1], ["SP", 8, 4, 128, [32], 1], ["AN", 8, 6, 1], ["AN", 8, 7, 1], ["RE", 8, [2, 4, 3, 5, 0, 1, 6, 7]], ["CI", 7], ["CHW", 6, "local"], ["SP", 6, 0, 4, [2, 2, 1, 1], 1], ["SP", 6, 5, 4, [1, 1, 1, 1], 1], ["SP", 6, 10, 196, [1, 196, 1, 1], 1], ["SP", 6, 15, 128, [2, 1, 1, 16], 1], ["SP", 6, 20, 128, [1, 4], 1], ["RE", 6, [0, 5, 10, 15, 1, 6, 11, 16, 2, 7, 12, 17, 20, 21, 3, 8, 13, 18, 22, 4, 9, 14, 19]], ["FSP", 7, 0, 10, 3], ["FSP", 7, 4, 11, 3], ["FSP", 7, 8, 12, 3], ["FSP", 7, 12, 13, 3], ["RE", 7, [0, 4, 8, 12, 1, 5, 9, 13, 2, 6, 10, 14, 3, 7, 11, 15]], ["CA", 6, 7, 11], ["CHR", 5, "shared", [6]], ["CA", 6, 7, 12], ["CHR", 4, "shared", [7]], ["CA", 5, 8, 12], ["AN", 4, 0, 1], ["AN", 4, 1, 1], ["SP", 4, 2, 196, [4], 1], ["SP", 4, 4, 128, [1], 1], ["AN", 4, 6, 1], ["AN", 4, 7, 1], ["RE", 4, [2, 4, 3, 5, 0, 1, 6, 7]], ["CI", 3], ["CA", 2, 4, 3], ["CI", 1], ["FU", 14, [0, 1, 2, 3]], ["SP", 14, 0, 100352, [32], 1], ["AN", 14, 0, 5], ["AN", 14, 1, 6], ["FU", 11, [0, 1, 2, 3]], ["SP", 11, 0, 25088, [32], 1], ["AN", 11, 0, 5], ["AN", 11, 1, 6], ["FU", 9, [0, 1, 2, 3]], ["AN", 9, 0, 5], ["FU", 9, [1, 2, 3, 4]], ["AN", 9, 1, 4], ["FU", 9, [2, 3, 4, 5]], ["AN", 9, 2, 6], ["FU", 7, [0, 1, 2, 3]], ["SP", 7, 0, 64, [1], 1], ["AN", 7, 1, 2], ["FFSP", 7, 0, [13, 12, 11, 10], 1, 1], ["AN", 7, 1, 6], ["FU", 5, [0, 1, 2, 3]], ["SP", 5, 0, 4, [1], 1], ["AN", 5, 1, 2], ["FFSP", 5, 0, [13, 12, 11, 10], 1, 1], ["AN", 5, 1, 6], ["FU", 4, [0, 1, 2, 3]], ["SP", 4, 0, 25088, [32], 1], ["AN", 4, 0, 5], ["AN", 4, 1, 6], ["PR", 4, 0, "auto_unroll_max_step$16"], ["PR", 8, 0, "auto_unroll_max_step$16"], ["PR", 11, 0, "auto_unroll_max_step$1024"]]]], "r": [[0.000184605], 0, 1.23683, 1649058970], "v": "v0.6"}
{"i": [["[\"dac19035dd5fe9424ee8617421b9c817\", 1, 28, 28, 128, 4, 4, 128, 128, 1, 28, 28, 128, 1, 28, 28, 128]", "cuda -keys=cuda,gpu -max_num_threads=1024 -thread_warp_size=32", [-1, 16, 64, 2147483647, 2147483647, 1024, 8, 32], "", 0, []], [[], [["CI", 9], ["AN", 8, 0, 1], ["AN", 8, 1, 1], ["SP", 8, 2, 196, [28], 1], ["SP", 8, 4, 128, [16], 1], ["AN", 8, 6, 1], ["AN", 8, 7, 1], ["RE", 8, [2, 4, 3, 5, 0, 1, 6, 7]], ["CI", 7], ["CHW", 6, "local"], ["SP", 6, 0, 4, [1, 1, 1, 1], 1], ["SP", 6, 5, 4, [1, 4, 1, 1], 1], ["SP", 6, 10, 196, [2, 14, 7, 1], 1], ["SP", 6, 15, 128, [1, 8, 2, 1], 1], ["SP", 6, 20, 128, [1, 1], 1], ["RE", 6, [0, 5, 10, 15, 1, 6, 11, 16, 2, 7, 12, 17, 20, 21, 3, 8, 13, 18, 22, 4, 9, 14, 19]], ["FSP", 7, 0, 10, 3], ["FSP", 7, 4, 11, 3], ["FSP", 7, 8, 12, 3], ["FSP", 7, 12, 13, 3], ["RE", 7, [0, 4, 8, 12, 1, 5, 9, 13, 2, 6, 10, 14, 3, 7, 11, 15]], ["CA", 6, 7, 11], ["CHR", 5, "shared", [6]], ["CA", 6, 7, 12], ["CHR", 4, "shared", [7]], ["CA", 5, 8, 12], ["AN", 4, 0, 1], ["AN", 4, 1, 1], ["SP", 4, 2, 196, [2], 1], ["SP", 4, 4, 128, [2], 1], ["AN", 4, 6, 1], ["AN", 4, 7, 1], ["RE", 4, [2, 4, 3, 5, 0, 1, 6, 7]], ["CI", 3], ["CA", 2, 4, 3], ["CI", 1], ["FU", 14, [0, 1, 2, 3]], ["SP", 14, 0, 100352, [32], 1], ["AN", 14, 0, 5], ["AN", 14, 1, 6], ["FU", 11, [0, 1, 2, 3]], ["SP", 11, 0, 25088, [64], 1], ["AN", 11, 0, 5], ["AN", 11, 1, 6], ["FU", 9, [0, 1, 2, 3]], ["AN", 9, 0, 5], ["FU", 9, [1, 2, 3, 4]], ["AN", 9, 1, 4], ["FU", 9, [2, 3, 4, 5]], ["AN", 9, 2, 6], ["FU", 7, [0, 1, 2, 3]], ["SP", 7, 0, 2, [1], 1], ["AN", 7, 1, 2], ["FFSP", 7, 0, [13, 12, 11, 10], 1, 1], ["AN", 7, 1, 6], ["FU", 5, [0, 1, 2, 3]], ["SP", 5, 0, 7, [1], 1], ["AN", 5, 1, 2], ["FFSP", 5, 0, [13, 12, 11, 10], 1, 1], ["AN", 5, 1, 6], ["FU", 4, [0, 1, 2, 3]], ["SP", 4, 0, 25088, [32], 1], ["AN", 4, 0, 5], ["AN", 4, 1, 6], ["PR", 4, 0, "auto_unroll_max_step$0"], ["PR", 8, 0, "auto_unroll_max_step$1024"], ["PR", 11, 0, "auto_unroll_max_step$64"]]]], "r": [[0.000193307], 0, 1.41059, 1649058972], "v": "v0.6"}
{"i": [["[\"12b88bedece6984af589a28b43e0f3c4\", 1, 56, 56, 64, 3, 3, 64, 128, 1, 1, 1, 128, 1, 28, 28, 128]", "cuda -keys=cuda,gpu -max_num_threads=1024 -thread_warp_size=32", [-1, 16, 64, 2147483647, 2147483647, 1024, 8, 32], "", 0, []], [[], [["CI", 5], ["SP", 3, 0, 1, [1, 1, 1, 1], 1], ["SP", 3, 5, 28, [1, 1, 1, 2], 1], ["SP", 3, 10, 28, [1, 14, 1, 1], 1], ["SP", 3, 15, 128, [1, 2, 1, 64], 1], ["SP", 3, 20, 3, [1, 1], 1], ["SP", 3, 23, 3, [3, 1], 1], ["SP", 3, 26, 64, [1, 1], 1], ["RE", 3, [0, 5, 10, 15, 1, 6, 11, 16, 2, 7, 12, 17, 20, 23, 26, 21, 24, 27, 3, 8, 13, 18, 22, 25, 28, 4, 9, 14, 19]], ["FSP", 6, 0, 1, 3], ["FSP", 6, 4, 2, 3], ["FSP", 6, 8, 3, 3], ["FSP", 6, 12, 4, 3], ["RE", 6, [0, 4, 8, 12, 1, 5, 9, 13, 2, 6, 10, 14, 3, 7, 11, 15]], ["CA", 3, 6, 11], ["CHR", 2, "shared", [3]], ["CA", 3, 4, 14], ["CHR", 1, "shared", [4]], ["CA", 2, 5, 14], ["CI", 1], ["FU", 8, [0, 1, 2, 3]], ["AN", 8, 0, 5], ["FU", 8, [1, 2, 3, 4]], ["AN", 8, 1, 4], ["FU", 8, [2, 3, 4, 5]], ["AN", 8, 2, 6], ["FU", 4, [0, 1, 2, 3]], ["SP", 4, 0, 96, [1], 1], ["AN", 4, 1, 2], ["FFSP", 4, 0, [4, 3, 2, 1], 1, 1], ["AN", 4, 1, 6], ["FU", 2, [0, 1, 2, 3]], ["SP", 2, 0, 9, [9], 1], ["AN", 2, 1, 2], ["FFSP", 2, 0, [4, 3, 2, 1], 1, 1], ["AN", 2, 1, 6], ["PR", 5, 0, "auto_unroll_max_step$1024"]]]], "r": [[0.000226262], 0, 1.36627, 1649058988], "v": "v0.6"}
{"i": [["[\"12b88bedece6984af589a28b43e0f3c4\", 1, 56, 56, 64, 3, 3, 64, 128, 1, 1, 1, 128, 1, 28, 28, 128]", "cuda -keys=cuda,gpu -max_num_threads=1024 -thread_warp_size=32", [-1, 16, 64, 2147483647, 2147483647, 1024, 8, 32], "", 0, []], [[], [["CI", 5], ["SP", 3, 0, 1, [1, 1, 1, 1], 1], ["SP", 3, 5, 28, [1, 28, 1, 1], 1], ["SP", 3, 10, 28, [1, 1, 14, 2], 1], ["SP", 3, 15, 128, [2, 2, 2, 2], 1], ["SP", 3, 20, 3, [1, 3], 1], ["SP", 3, 23, 3, [1, 3], 1], ["SP", 3, 26, 64, [2, 1], 1], ["RE", 3, [0, 5, 10, 15, 1, 6, 11, 16, 2, 7, 12, 17, 20, 23, 26, 21, 24, 27, 3, 8, 13, 18, 22, 25, 28, 4, 9, 14, 19]], ["FSP", 6, 0, 1, 3], ["FSP", 6, 4, 2, 3], ["FSP", 6, 8, 3, 3], ["FSP", 6, 12, 4, 3], ["RE", 6, [0, 4, 8, 12, 1, 5, 9, 13, 2, 6, 10, 14, 3, 7, 11, 15]], ["CA", 3, 6, 11], ["CHR", 2, "shared", [3]], ["CA", 3, 4, 14], ["CHR", 1, "shared", [4]], ["CA", 2, 5, 14], ["CI", 1], ["FU", 8, [0, 1, 2, 3]], ["AN", 8, 0, 5], ["FU", 8, [1, 2, 3, 4]], ["AN", 8, 1, 4], ["FU", 8, [2, 3, 4, 5]], ["AN", 8, 2, 6], ["FU", 4, [0, 1, 2, 3]], ["SP", 4, 0, 576, [1], 1], ["AN", 4, 1, 2], ["FFSP", 4, 0, [4, 3, 2, 1], 1, 1], ["AN", 4, 1, 6], ["FU", 2, [0, 1, 2, 3]], ["SP", 2, 0, 1296, [1], 1], ["AN", 2, 1, 2], ["FFSP", 2, 0, [4, 3, 2, 1], 1, 1], ["AN", 2, 1, 6], ["PR", 5, 0, "auto_unroll_max_step$512"]]]], "r": [[0.000375392], 0, 1.6911, 1649058989], "v": "v0.6"}
{"i": [["[\"12b88bedece6984af589a28b43e0f3c4\", 1, 56, 56, 64, 3, 3, 64, 128, 1, 1, 1, 128, 1, 28, 28, 128]", "cuda -keys=cuda,gpu -max_num_threads=1024 -thread_warp_size=32", [-1, 16, 64, 2147483647, 2147483647, 1024, 8, 32], "", 0, []], [[], [["CI", 5], ["SP", 3, 0, 1, [1, 1, 1, 1], 1], ["SP", 3, 5, 28, [1, 1, 1, 4], 1], ["SP", 3, 10, 28, [1, 2, 1, 1], 1], ["SP", 3, 15, 128, [2, 1, 8, 4], 1], ["SP", 3, 20, 3, [1, 1], 1], ["SP", 3, 23, 3, [1, 3], 1], ["SP", 3, 26, 64, [1, 1], 1], ["RE", 3, [0, 5, 10, 15, 1, 6, 11, 16, 2, 7, 12, 17, 20, 23, 26, 21, 24, 27, 3, 8, 13, 18, 22, 25, 28, 4, 9, 14, 19]], ["FSP", 6, 0, 1, 3], ["FSP", 6, 4, 2, 3], ["FSP", 6, 8, 3, 3], ["FSP", 6, 12, 4, 3], ["RE", 6, [0, 4, 8, 12, 1, 5, 9, 13, 2, 6, 10, 14, 3, 7, 11, 15]], ["CA", 3, 6, 11], ["CHR", 2, "shared", [3]], ["CA", 3, 4, 14], ["CHR", 1, "shared", [4]], ["CA", 2, 5, 14], ["CI", 1], ["FU", 8, [0, 1, 2, 3]], ["AN", 8, 0, 5], ["FU", 8, [1, 2, 3, 4]], ["AN", 8, 1, 4], ["FU", 8, [2, 3, 4, 5]], ["AN", 8, 2, 6], ["FU", 4, [0, 1, 2, 3]], ["SP", 4, 0, 384, [1], 1], ["AN", 4, 1, 2], ["FFSP", 4, 0, [4, 3, 2, 1], 1, 1], ["AN", 4, 1, 6], ["FU", 2, [0, 1, 2, 3]], ["SP", 2, 0, 12, [1], 1], ["AN", 2, 1, 2], ["FFSP", 2, 0, [4, 3, 2, 1], 1, 1], ["AN", 2, 1, 6], ["PR", 5, 0, "auto_unroll_max_step$1024"]]]], "r": [[0.00166121], 0, 2.04522, 1649058991], "v": "v0.6"}
{"i": [["[\"1e3c4211ffd2f2db91078ae4d04b779d\", 1, 56, 56, 64, 6, 6, 64, 64, 1, 56, 56, 64, 1, 1, 1, 64, 1, 56, 56, 64]", "cuda -keys=cuda,gpu -max_num_threads=1024 -thread_warp_size=32", [-1, 16, 64, 2147483647, 2147483647, 1024, 8, 32], "", 0, []], [[], [["CI", 13], ["CI", 11], ["CI", 9], ["AN", 8, 0, 1], ["AN", 8, 1, 1], ["SP", 8, 2, 196, [1], 1], ["SP", 8, 4, 64, [4], 1], ["AN", 8, 6, 1], ["AN", 8, 7, 1], ["RE", 8, [2, 4, 3, 5, 0, 1, 6, 7]], ["CI", 7], ["CHW", 6, "local"], ["SP", 6, 0, 6, [1, 3, 1, 1], 1], ["SP", 6, 5, 6, [2, 1, 1, 1], 1], ["SP", 6, 10, 196, [1, 4, 7, 1], 1], ["SP", 6, 15, 64, [1, 4, 2, 2], 1], ["SP", 6, 20, 64, [2, 4], 1], ["RE", 6, [0, 5, 10, 15, 1, 6, 11, 16, 2, 7, 12, 17, 20, 21, 3, 8, 13, 18, 22, 4, 9, 14, 19]], ["FSP", 7, 0, 12, 3], ["FSP", 7, 4, 13, 3], ["FSP", 7, 8, 14, 3], ["FSP", 7, 12, 15, 3], ["RE", 7, [0, 4, 8, 12, 1, 5, 9, 13, 2, 6, 10, 14, 3, 7, 11, 15]], ["CA", 6, 7, 11], ["CHR", 5, "shared", [6]], ["CA", 6, 7, 12], ["CHR", 4, "shared", [7]], ["CA", 5, 8, 12], ["AN", 4, 0, 1], ["AN", 4, 1, 1], ["SP", 4, 2, 196, [7], 1], ["SP", 4, 4, 64, [32], 1], ["AN", 4, 6, 1], ["AN", 4, 7, 1], ["RE", 4, [2, 4, 3, 5, 0, 1, 6, 7]], ["CI", 3], ["CA", 2, 4, 3], ["CI", 1], ["FU", 17, [0, 1, 2, 3]], ["SP", 17, 0, 200704, [32], 1], ["AN", 17, 0, 5], ["AN", 17, 1, 6], ["FU", 11, [0, 1, 2, 3]], ["SP", 11, 0, 12544, [1], 1], ["AN", 11, 0, 5], ["AN", 11, 1, 6], ["FU", 9, [0, 1, 2, 3]], ["AN", 9, 0, 5], ["FU", 9, [1, 2, 3, 4]], ["AN", 9, 1, 4], ["FU", 9, [2, 3, 4, 5]], ["AN", 9, 2, 6], ["FU", 7, [0, 1, 2, 3]], ["SP", 7, 0, 32, [1], 1], ["AN", 7, 1, 2], ["FFSP", 7, 0, [15, 14, 13, 12], 1, 1], ["AN", 7, 1, 6], ["FU", 5, [0, 1, 2, 3]], ["SP", 5, 0, 56, [1], 1], ["AN", 5, 1, 2], ["FFSP", 5, 0, [15, 14, 13, 12], 1, 1], ["AN", 5, 1, 6], ["FU", 4, [0, 1, 2, 3]], ["SP", 4, 0, 12544, [32], 1], ["AN", 4, 0, 5], ["AN", 4, 1, 6], ["PR", 4, 0, "auto_unroll_max_step$1024"], ["PR", 8, 0, "auto_unroll_max_step$16"], ["PR", 11, 0, "auto_unroll_max_step$64"]]]], "r": [[9.35786e-05], 0, 2.13509, 1649059023], "v": "v0.6"}
{"i": [["[\"3ea73fb9b0364374730d09e068821f95\", 1, 56, 56, 64, 6, 6, 64, 64, 1, 56, 56, 64, 1, 56, 56, 64]", "cuda -keys=cuda,gpu -max_num_threads=1024 -thread_warp_size=32", [-1, 16, 64, 2147483647, 2147483647, 1024, 8, 32], "", 0, []], [[], [["CI", 9], ["AN", 8, 0, 1], ["AN", 8, 1, 1], ["SP", 8, 2, 196, [7], 1], ["SP", 8, 4, 64, [8], 1], ["AN", 8, 6, 1], ["AN", 8, 7, 1], ["RE", 8, [2, 4, 3, 5, 0, 1, 6, 7]], ["CI", 7], ["CHW", 6, "local"], ["SP", 6, 0, 6, [1, 1, 3, 1], 1], ["SP", 6, 5, 6, [2, 1, 1, 3], 1], ["SP", 6, 10, 196, [1, 14, 1, 2], 1], ["SP", 6, 15, 64, [2, 8, 1, 1], 1], ["SP", 6, 20, 64, [8, 1], 1], ["RE", 6, [0, 5, 10, 15, 1, 6, 11, 16, 2, 7, 12, 17, 20, 21, 3, 8, 13, 18, 22, 4, 9, 14, 19]], ["FSP", 7, 0, 10, 3], ["FSP", 7, 4, 11, 3], ["FSP", 7, 8, 12, 3], ["FSP", 7, 12, 13, 3], ["RE", 7, [0, 4, 8, 12, 1, 5, 9, 13, 2, 6, 10, 14, 3, 7, 11, 15]], ["CA", 6, 7, 11], ["CHR", 5, "shared", [6]], ["CA", 6, 7, 12], ["CHR", 4, "shared", [7]], ["CA", 5, 8, 12], ["AN", 4, 0, 1], ["AN", 4, 1, 1], ["SP", 4, 2, 196, [49], 1], ["SP", 4, 4, 64, [32], 1], ["AN", 4, 6, 1], ["AN", 4, 7, 1], ["RE", 4, [2, 4, 3, 5, 0, 1, 6, 7]], ["CI", 3], ["CA", 2, 4, 3], ["CI", 1], ["FU", 14, [0, 1, 2, 3]], ["SP", 14, 0, 200704, [32], 1], ["AN", 14, 0, 5], ["AN", 14, 1, 6], ["FU", 11, [0, 1, 2, 3]], ["SP", 11, 0, 12544, [32], 1], ["AN", 11, 0, 5], ["AN", 11, 1, 6], ["FU", 9, [0, 1, 2, 3]], ["AN", 9, 0, 5], ["FU", 9, [1, 2, 3, 4]], ["AN", 9, 1, 4], ["FU", 9, [2, 3, 4, 5]], ["AN", 9, 2, 6], ["FU", 7, [0, 1, 2, 3]], ["SP", 7, 0, 72, [1], 1], ["AN", 7, 1, 2], ["FFSP", 7, 0, [13, 12, 11, 10], 1, 1], ["AN", 7, 1, 6], ["FU", 5, [0, 1, 2, 3]], ["SP", 5, 0, 144, [1], 1], ["AN", 5, 1, 2], ["FFSP", 5, 0, [13, 12, 11, 10], 1, 1], ["AN", 5, 1, 6], ["FU", 4, [0, 1, 2, 3]], ["SP", 4, 0, 12544, [32], 1], ["AN", 4, 0, 5], ["AN", 4, 1, 6], ["PR", 4, 0, "auto_unroll_max_step$1024"], ["PR", 8, 0, "auto_unroll_max_step$1024"], ["PR", 11, 0, "auto_unroll_max_step$512"]]]], "r": [[8.96399e-05], 0, 2.9456, 1649059094], "v": "v0.6"}
{"i": [["[\"3ea73fb9b0364374730d09e068821f95\", 1, 56, 56, 64, 6, 6, 64, 64, 1, 56, 56, 64, 1, 56, 56, 64]", "cuda -keys=cuda,gpu -max_num_threads=1024 -thread_warp_size=32", [-1, 16, 64, 2147483647, 2147483647, 1024, 8, 32], "", 0, []], [[], [["CI", 9], ["AN", 8, 0, 1], ["AN", 8, 1, 1], ["SP", 8, 2, 196, [4], 1], ["SP", 8, 4, 64, [2], 1], ["AN", 8, 6, 1], ["AN", 8, 7, 1], ["RE", 8, [2, 4, 3, 5, 0, 1, 6, 7]], ["CI", 7], ["CHW", 6, "local"], ["SP", 6, 0, 6, [1, 2, 1, 3], 1], ["SP", 6, 5, 6, [1, 1, 1, 1], 1], ["SP", 6, 10, 196, [7, 2, 2, 1], 1], ["SP", 6, 15, 64, [1, 8, 1, 2], 1], ["SP", 6, 20, 64, [1, 1], 1], ["RE", 6, [0, 5, 10, 15, 1, 6, 11, 16, 2, 7, 12, 17, 20, 21, 3, 8, 13, 18, 22, 4, 9, 14, 19]], ["FSP", 7, 0, 10, 3], ["FSP", 7, 4, 11, 3], ["FSP", 7, 8, 12, 3], ["FSP", 7, 12, 13, 3], ["RE", 7, [0, 4, 8, 12, 1, 5, 9, 13, 2, 6, 10, 14, 3, 7, 11, 15]], ["CA", 6, 7, 11], ["CHR", 5, "shared", [6]], ["CA", 6, 7, 12], ["CHR", 4, "shared", [7]], ["CA", 5, 8, 12], ["AN", 4, 0, 1], ["AN", 4, 1, 1], ["SP", 4, 2, 196, [7], 1], ["SP", 4, 4, 64, [1], 1], ["AN", 4, 6, 1], ["AN", 4, 7, 1], ["RE", 4, [2, 4, 3, 5, 0, 1, 6, 7]], ["CI", 3], ["CA", 2, 4, 3], ["CI", 1], ["FU", 14, [0, 1, 2, 3]], ["SP", 14, 0, 200704, [32], 1], ["AN", 14, 0, 5], ["AN", 14, 1, 6], ["FU", 11, [0, 1, 2, 3]], ["SP", 11, 0, 12544, [32], 1], ["AN", 11, 0, 5], ["AN", 11, 1, 6], ["FU", 9, [0, 1, 2, 3]], ["AN", 9, 0, 5], ["FU", 9, [1, 2, 3, 4]], ["AN", 9, 1, 4], ["FU", 9, [2, 3, 4, 5]], ["AN", 9, 2, 6], ["FU", 7, [0, 1, 2, 3]], ["SP", 7, 0, 6, [1], 1], ["AN", 7, 1, 2], ["FFSP", 7, 0, [13, 12, 11, 10], 1, 1], ["AN", 7, 1, 6], ["FU", 5, [0, 1, 2, 3]], ["SP", 5, 0, 6, [1], 1], ["AN", 5, 1, 2], ["FFSP", 5, 0, [13, 12, 11, 10], 1, 1], ["AN", 5, 1, 6], ["FU", 4, [0, 1, 2, 3]], ["SP", 4, 0, 12544, [8], 1], ["AN", 4, 0, 5], ["AN", 4, 1, 6], ["PR", 4, 0, "auto_unroll_max_step$512"], ["PR", 8, 0, "auto_unroll_max_step$16"], ["PR", 11, 0, "auto_unroll_max_step$0"]]]], "r": [[0.00015173], 0, 2.68115, 1649059095], "v": "v0.6"}
{"i": [["[\"a5612fdeb9db4d579a75ec225ea4c06a\", 1, 112, 112, 64, 1, 1, 1, 64, 1, 56, 56, 64]", "cuda -keys=cuda,gpu -max_num_threads=1024 -thread_warp_size=32", [-1, 16, 64, 2147483647, 2147483647, 1024, 8, 32], "", 0, []], [[], [["CI", 4], ["CI", 1], ["FU", 5, [0, 1, 2, 3]], ["SP", 5, 0, 200704, [32], 1], ["AN", 5, 0, 5], ["AN", 5, 1, 6], ["FU", 2, [0, 1, 2, 3]], ["SP", 2, 0, 200704, [64], 1], ["AN", 2, 0, 5], ["AN", 2, 1, 6], ["PR", 2, 0, "auto_unroll_max_step$512"]]]], "r": [[1.96466e-05], 0, 1.06162, 1649059123], "v": "v0.6"}
{"i": [["[\"a5612fdeb9db4d579a75ec225ea4c06a\", 1, 112, 112, 64, 1, 1, 1, 64, 1, 56, 56, 64]", "cuda -keys=cuda,gpu -max_num_threads=1024 -thread_warp_size=32", [-1, 16, 64, 2147483647, 2147483647, 1024, 8, 32], "", 0, []], [[], [["CI", 4], ["CI", 1], ["FU", 5, [0, 1, 2, 3]], ["SP", 5, 0, 200704, [2], 1], ["AN", 5, 0, 5], ["AN", 5, 1, 6], ["FU", 2, [0, 1, 2, 3]], ["SP", 2, 0, 200704, [8], 1], ["AN", 2, 0, 5], ["AN", 2, 1, 6], ["PR", 2, 0, "auto_unroll_max_step$0"]]]], "r": [[0.000130131], 0, 1.18421, 1649059123], "v": "v0.6"}
{"i": [["[\"a5612fdeb9db4d579a75ec225ea4c06a\", 1, 112, 112, 64, 1, 1, 1, 64, 1, 56, 56, 64]", "cuda -keys=cuda,gpu -max_num_threads=1024 -thread_warp_size=32", [-1, 16, 64, 2147483647, 2147483647, 1024, 8, 32], "", 0, []], [[], [["CI", 4], ["CI", 1], ["FU", 5, [0, 1, 2, 3]], ["SP", 5, 0, 200704, [32], 1], ["AN", 5, 0, 5], ["AN", 5, 1, 6], ["FU", 2, [0, 1, 2, 3]], ["SP", 2, 0, 200704, [16], 1], ["AN", 2, 0, 5], ["AN", 2, 1, 6], ["PR", 2, 0, "auto_unroll_max_step$64"]]]], "r": [[2.61367e-05], 0, 1.21951, 1649059124], "v": "v0.6"}
{"i": [["[\"a5612fdeb9db4d579a75ec225ea4c06a\", 1, 112, 112, 64, 1, 1, 1, 64, 1, 56, 56, 64]", "cuda -keys=cuda,gpu -max_num_threads=1024 -thread_warp_size=32", [-1, 16, 64, 2147483647, 2147483647, 1024, 8, 32], "", 0, []], [[], [["CI", 4], ["CI", 1], ["FU", 5, [0, 1, 2, 3]], ["SP", 5, 0, 200704, [32], 1], ["AN", 5, 0, 5], ["AN", 5, 1, 6], ["FU", 2, [0, 1, 2, 3]], ["SP", 2, 0, 200704, [32], 1], ["AN", 2, 0, 5], ["AN", 2, 1, 6], ["PR", 2, 0, "auto_unroll_max_step$512"]]]], "r": [[1.87288e-05], 0, 1.12359, 1649059125], "v": "v0.6"}
{"i": [["[\"a5612fdeb9db4d579a75ec225ea4c06a\", 1, 112, 112, 64, 1, 1, 1, 64, 1, 56, 56, 64]", "cuda -keys=cuda,gpu -max_num_threads=1024 -thread_warp_size=32", [-1, 16, 64, 2147483647, 2147483647, 1024, 8, 32], "", 0, []], [[], [["CI", 4], ["CI", 1], ["FU", 5, [0, 1, 2, 3]], ["SP", 5, 0, 200704, [32], 1], ["AN", 5, 0, 5], ["AN", 5, 1, 6], ["FU", 2, [0, 1, 2, 3]], ["SP", 2, 0, 200704, [7], 1], ["AN", 2, 0, 5], ["AN", 2, 1, 6], ["PR", 2, 0, "auto_unroll_max_step$1024"]]]], "r": [[4.38328e-05], 0, 1.11783, 1649059126], "v": "v0.6"}
